id,arxiv_id,title,authors,date,year,venue,topics,uav_relevance,abs_url,pdf_url,code_url,project_url,query_source
7a659c52aa50,2603.03739v1,PROSPECT: Unified Streaming Vision-Language Navigation via Semantic--Spatial Fusion and Latent Predictive Representation,Zehua Fan; Wenqi Lyu; Wenxuan Song; Linge Zhao; Yifei Yang; Xi Wang; Junjie He; Lida Huang; Haiyan Liu; Bingchuan Sun; Guangjun Bao; Xuanyao Mao; Liang Xu; Yan Wang; Feng Gao,2026-03-04,2026,arXiv,Foundations; Datasets & Simulators,Medium,https://arxiv.org/abs/2603.03739v1,https://arxiv.org/pdf/2603.03739v1,,,"""vision-language navigation"""
1d076252ecc4,2603.04029v1,Self-adapting Robotic Agents through Online Continual Reinforcement Learning with World Model Feedback,Fabian Domberg; Georg Schildbach,2026-03-04,2026,IROS,UAV WAM,Low,https://arxiv.org/abs/2603.04029v1,https://arxiv.org/pdf/2603.04029v1,,,"""model-based reinforcement learning"""
6e20e60ea751,2603.04470v1,Efficient Autonomous Navigation of a Quadruped Robot in Underground Mines on Edge Hardware,Yixiang Gao; Kwame Awuah-Offei,2026-03-04,2026,arXiv,Evaluation; Traditional UAV VLN,Medium,https://arxiv.org/abs/2603.04470v1,https://arxiv.org/pdf/2603.04470v1,,,"""embodied navigation"""
1b15353390cc,2603.04284v1,OmniPlanner: Universal Exploration and Inspection Path Planning across Robot Morphologies,Angelos Zacharia; Mihir Dharmadhikari; Mohit Singh; Kostas Alexis,2026-03-04,2026,arXiv,Traditional UAV VLN,High,https://arxiv.org/abs/2603.04284v1,https://arxiv.org/pdf/2603.04284v1,,,"((uav OR drone OR aerial) AND (""slam"" OR ""path planning"" OR ""obstacle avoidance"" OR ""semantic map""))"
3254d6df7269,2603.03024v1,MA-CoNav: A Master-Slave Multi-Agent Framework with Hierarchical Collaboration and Dual-Level Reflection for Long-Horizon Embodied VLN,Ling Luo; Qianqian Bai,2026-03-03,2026,arXiv,Foundations,Medium,https://arxiv.org/abs/2603.03024v1,https://arxiv.org/pdf/2603.03024v1,,,"(""vision-language navigation"" AND (evaluation OR metric OR SPL OR ""success rate"" OR ""sim-to-real""))"
ec140638b717,2603.02972v2,TagaVLM: Topology-Aware Global Action Reasoning for Vision-Language Navigation,Jiaxing Liu; Zexi Zhang; Xiaoyan Li; Boyue Wang; Yongli Hu; Baocai Yin,2026-03-03,2026,arXiv,Foundations; Evaluation,Medium,https://arxiv.org/abs/2603.02972v2,https://arxiv.org/pdf/2603.02972v2,,,"(""vision-language navigation"" AND (evaluation OR metric OR SPL OR ""success rate"" OR ""sim-to-real""))"
179187aa914f,2603.03485v2,Phys4D: Fine-Grained Physics-Consistent 4D Modeling from Video Diffusion,Haoran Lu; Shang Wu; Jianshu Zhang; Maojiang Su; Guo Ye; Chenwei Xu; Lie Lu; Pranav Maneriker; Fan Du; Manling Li; Zhaoran Wang; Han Liu,2026-03-03,2026,arXiv,Evaluation,Medium,https://arxiv.org/abs/2603.03485v2,https://arxiv.org/pdf/2603.03485v2,,,"""generative world model"""
9a9fb5066519,2603.02765v1,Next Embedding Prediction Makes World Models Stronger,George Bredis; Nikita Balagansky; Daniil Gavrilov; Ruslan Rakhimov,2026-03-03,2026,arXiv,UAV WAM,Low,https://arxiv.org/abs/2603.02765v1,https://arxiv.org/pdf/2603.02765v1,,,"""model-based reinforcement learning"""
4ec403cef4fb,2603.02772v1,Agentic Self-Evolutionary Replanning for Embodied Navigation,Guoliang Li; Ruihua Han; Chengyang Li; He Li; Shuai Wang; Wenchao Ding; Hong Zhang; Chengzhong Xu,2026-03-03,2026,arXiv,Foundations,Medium,https://arxiv.org/abs/2603.02772v1,https://arxiv.org/pdf/2603.02772v1,,,"""embodied navigation"""
ee27b685c255,2603.02291v1,Goal-Oriented Semantic Communication for ISAC-Enabled Robotic Obstacle Avoidance,Wenjie Liu; Yansha Deng; Henk Wymeersch,2026-03-02,2026,arXiv,Traditional UAV VLN,High,https://arxiv.org/abs/2603.02291v1,https://arxiv.org/pdf/2603.02291v1,,,"((uav OR drone OR aerial) AND (""slam"" OR ""path planning"" OR ""obstacle avoidance"" OR ""semantic map""))"
215d2bb517bb,2603.01452v1,"Scaling Tasks, Not Samples: Mastering Humanoid Control through Multi-Task Model-Based Reinforcement Learning",Shaohuai Liu; Weirui Ye; Yilun Du; Le Xie,2026-03-02,2026,arXiv,UAV WAM,Low,https://arxiv.org/abs/2603.01452v1,https://arxiv.org/pdf/2603.01452v1,,,"""model-based reinforcement learning"""
19108ad16a99,2603.02004v1,CHOP: Counterfactual Human Preference Labels Improve Obstacle Avoidance in Visuomotor Navigation Policies,Gershom Seneviratne; Jianyu An; Vaibhav Shende; Sahire Ellahy; Yaxita Amin; Kondapi Manasanjani; Samarth Chopra; Jonathan Deepak Kannan; Dinesh Manocha,2026-03-02,2026,arXiv,Traditional UAV VLN,Low,https://arxiv.org/abs/2603.02004v1,https://arxiv.org/pdf/2603.02004v1,,,"""embodied navigation"""
a8a41bc0118b,2602.23937v1,Enhancing Vision-Language Navigation with Multimodal Event Knowledge from Real-World Indoor Tour Videos,Haoxuan Xu; Tianfu Li; Wenbo Chen; Yi Liu; Xingxing Zuo; Yaoxian Song; Haoang Li,2026-02-27,2026,arXiv,Foundations,Medium,https://arxiv.org/abs/2602.23937v1,https://arxiv.org/pdf/2602.23937v1,,,"""vision-language navigation"""
7f2fe1806b4a,2602.24030v1,Curriculum Reinforcement Learning for Quadrotor Racing with Random Obstacles,Fangyu Sun; Fanxing Li; Yu Hu; Linzuo Zhang; Yueqian Liu; Wenxian Yu; Danping Zou,2026-02-27,2026,arXiv,Traditional UAV VLN,High,https://arxiv.org/abs/2602.24030v1,https://arxiv.org/pdf/2602.24030v1,,,"((uav OR drone OR aerial) AND (""slam"" OR ""path planning"" OR ""obstacle avoidance"" OR ""semantic map""))"
bbf0947db7e2,2602.21633v1,Self-Correcting VLA: Online Action Refinement via Sparse World Imagination,Chenyv Liu; Wentao Tan; Lei Zhu; Fengling Li; Jingjing Li; Guoli Yang; Heng Tao Shen,2026-02-25,2026,arXiv,Evaluation,Medium,https://arxiv.org/abs/2602.21633v1,https://arxiv.org/pdf/2602.21633v1,,,"""world action model"""
cd28d7381ffd,2602.22208v2,Solaris: Building a Multiplayer Video World Model in Minecraft,Georgy Savva; Oscar Michel; Daohan Lu; Suppakit Waiwitlikhit; Timothy Meehan; Dhairya Mishra; Srivats Poddar; Jack Lu; Saining Xie,2026-02-25,2026,arXiv,UAV WAM,Low,https://arxiv.org/abs/2602.22208v2,https://arxiv.org/pdf/2602.22208v2,,,"""action-conditioned video generation"""
316489e9e45f,2602.21816v1,Self-Curriculum Model-based Reinforcement Learning for Shape Control of Deformable Linear Objects,Zhaowei Liang; Song Wang; Zhao Jin; Shirui Wu; Dan Wu,2026-02-25,2026,arXiv,UAV WAM; Evaluation,Medium,https://arxiv.org/abs/2602.21816v1,https://arxiv.org/pdf/2602.21816v1,,,"""model-based reinforcement learning"""
aa37e4f52d92,2602.19503v1,A Text-Guided Vision Model for Enhanced Recognition of Small Instances,Hyun-Ki Jung,2026-02-23,2026,arXiv,Datasets & Simulators,Medium,https://arxiv.org/abs/2602.19503v1,https://arxiv.org/pdf/2602.19503v1,,,"((uav OR drone OR aerial) AND (""world model"" OR ""future observation prediction"" OR ""model-based reinforcement learning""))"
4580d989fe8e,2602.18976v1,Bumper Drone: Elastic Morphology Design for Aerial Physical Interaction,Pongporn Supa; Alex Dunnett; Feng Xiao; Rui Wu; Mirko Kovac; Basaran Bahadir Kocer,2026-02-21,2026,arXiv,Traditional UAV VLN,High,https://arxiv.org/abs/2602.18976v1,https://arxiv.org/pdf/2602.18976v1,,,"((uav OR drone OR aerial) AND (""slam"" OR ""path planning"" OR ""obstacle avoidance"" OR ""semantic map""))"
5f4437d903b9,2602.18424v1,CapNav: Benchmarking Vision Language Models on Capability-conditioned Indoor Navigation,Xia Su; Ruiqi Chen; Benlin Liu; Jingwei Ma; Zonglin Di; Ranjay Krishna; Jon Froehlich,2026-02-20,2026,arXiv,Foundations,Medium,https://arxiv.org/abs/2602.18424v1,https://arxiv.org/pdf/2602.18424v1,,,"(""vision-language navigation"" AND (evaluation OR metric OR SPL OR ""success rate"" OR ""sim-to-real""))"
387dae8f6c1a,2602.15922v1,World Action Models are Zero-shot Policies,"Seonghyeon Ye; Yunhao Ge; Kaiyuan Zheng; Shenyuan Gao; Sihyun Yu; George Kurian; Suneel Indupuru; You Liang Tan; Chuning Zhu; Jiannan Xiang; Ayaan Malik; Kyungmin Lee; William Liang; Nadun Ranawaka; Jiasheng Gu; Yinzhen Xu; Guanzhi Wang; Fengyuan Hu; Avnish Narayan; Johan Bjorck; Jing Wang; Gwanghyun Kim; Dantong Niu; Ruijie Zheng; Yuqi Xie; Jimmy Wu; Qi Wang; Ryan Julian; Danfei Xu; Yilun Du; Yevgen Chebotar; Scott Reed; Jan Kautz; Yuke Zhu; Linxi ""Jim"" Fan; Joel Jang",2026-02-17,2026,arXiv,UAV WAM,Low,https://arxiv.org/abs/2602.15922v1,https://arxiv.org/pdf/2602.15922v1,,,"""world action model"""
0a17be9a077f,2602.14401v1,pFedNavi: Structure-Aware Personalized Federated Vision-Language Navigation for Embodied AI,Qingqian Yang; Hao Wang; Sai Qian Zhang; Jian Li; Yang Hua; Miao Pan; Tao Song; Zhengwei Qi; Haibing Guan,2026-02-16,2026,arXiv,Foundations; Evaluation,Medium,https://arxiv.org/abs/2602.14401v1,https://arxiv.org/pdf/2602.14401v1,,,"(""vision-language navigation"" AND (evaluation OR metric OR SPL OR ""success rate"" OR ""sim-to-real""))"
993dcf605f81,2602.13977v1,WoVR: World Models as Reliable Simulators for Post-Training VLA Policies with RL,Zhennan Jiang; Shangqing Zhou; Yutong Jiang; Zefang Huang; Mingjie Wei; Yuhui Chen; Tianxing Zhou; Zhen Guo; Hao Lin; Quanlu Zhang; Yu Wang; Haoran Li; Chao Yu; Dongbin Zhao,2026-02-15,2026,arXiv,UAV WAM,Low,https://arxiv.org/abs/2602.13977v1,https://arxiv.org/pdf/2602.13977v1,,,"""model-based reinforcement learning"""
522b7842b97a,2602.14247v1,"Path Planning Optimisation for SParse, AwaRe and Cooperative Networked Aerial Robot Teams (SpArC-NARTs): Optimisation Tool and Ground Sensing Coverage Use Cases",Maria Conceição; António Grilo; Meysam Basiri,2026-02-15,2026,arXiv,Traditional UAV VLN,High,https://arxiv.org/abs/2602.14247v1,https://arxiv.org/pdf/2602.14247v1,,,"((uav OR drone OR aerial) AND (""slam"" OR ""path planning"" OR ""obstacle avoidance"" OR ""semantic map""))"
75103b826d2a,2602.12520v1,Multi-Agent Model-Based Reinforcement Learning with Joint State-Action Learned Embeddings,Zhizun Wang; David Meger,2026-02-13,2026,arXiv,UAV WAM,Low,https://arxiv.org/abs/2602.12520v1,https://arxiv.org/pdf/2602.12520v1,,,"""model-based reinforcement learning"""
ecccd4405ad7,2602.12838v1,SKYSURF: A Self-learning Framework for Persistent Surveillance using Cooperative Aerial Gliders,Houssem Eddine Mohamadi; Nadjia Kara,2026-02-13,2026,arXiv,Traditional UAV VLN,High,https://arxiv.org/abs/2602.12838v1,https://arxiv.org/pdf/2602.12838v1,,,"((uav OR drone OR aerial) AND (""slam"" OR ""path planning"" OR ""obstacle avoidance"" OR ""semantic map""))"
62fbe6147269,2602.12063v2,VLAW: Iterative Co-Improvement of Vision-Language-Action Policy and World Model,Yanjiang Guo; Tony Lee; Lucy Xiaoyang Shi; Jianyu Chen; Percy Liang; Chelsea Finn,2026-02-12,2026,arXiv,UAV VLA,Low,https://arxiv.org/abs/2602.12063v2,https://arxiv.org/pdf/2602.12063v2,,,"""action-conditioned video generation"""
3da5169b9261,2602.12099v2,GigaBrain-0.5M*: a VLA That Learns From World Model-Based Reinforcement Learning,GigaBrain Team; Boyuan Wang; Bohan Li; Chaojun Ni; Guan Huang; Guosheng Zhao; Hao Li; Jie Li; Jindi Lv; Jingyu Liu; Lv Feng; Mingming Yu; Peng Li; Qiuping Deng; Tianze Liu; Xinyu Zhou; Xinze Chen; Xiaofeng Wang; Yang Wang; Yifan Li; Yifei Nie; Yilong Li; Yukun Zhou; Yun Ye; Zhichao Liu; Zheng Zhu,2026-02-12,2026,arXiv,UAV WAM,Low,https://arxiv.org/abs/2602.12099v2,https://arxiv.org/pdf/2602.12099v2,,,"""model-based reinforcement learning"""
e20ec084147a,2602.11598v1,ABot-N0: Technical Report on the VLA Foundation Model for Versatile Embodied Navigation,Zedong Chu; Shichao Xie; Xiaolong Wu; Yanfen Shen; Minghua Luo; Zhengbo Wang; Fei Liu; Xiaoxu Leng; Junjun Hu; Mingyang Yin; Jia Lu; Yingnan Guo; Kai Yang; Jiawei Han; Xu Chen; Yanqing Zhu; Yuxiang Zhao; Xin Liu; Yirong Yang; Ye He; Jiahang Wang; Yang Cai; Tianlin Zhang; Li Gao; Liu Liu; Mingchao Sun; Fan Jiang; Chiyu Wang; Zhicheng Liu; Hongyu Pan; Honglin Han; Zhining Gu; Kuan Yang; Jianfang Zhang; Di Jing; Zihao Guan; Wei Guo; Guoqing Liu; Di Yang; Xiangpo Yang; Menglin Yang; Hongguang Xing; Weiguo Li; Mu Xu,2026-02-12,2026,arXiv,Foundations,Medium,https://arxiv.org/abs/2602.11598v1,https://arxiv.org/pdf/2602.11598v1,,,"""embodied navigation"""
f95c17927225,2602.12055v1,Multi UAVs Preflight Planning in a Shared and Dynamic Airspace,Amath Sow; Mauricio Rodriguez Cesen; Fabiola Martins Campos de Oliveira; Mariusz Wzorek; Daniel de Leng; Mattias Tiger; Fredrik Heintz; Christian Esteve Rothenberg,2026-02-12,2026,arXiv,Traditional UAV VLN,High,https://arxiv.org/abs/2602.12055v1,https://arxiv.org/pdf/2602.12055v1,,,"((uav OR drone OR aerial) AND (""slam"" OR ""path planning"" OR ""obstacle avoidance"" OR ""semantic map""))"
4f38b74134e5,2602.11735v1,AC-MASAC: An Attentive Curriculum Learning Framework for Heterogeneous UAV Swarm Coordination,Wanhao Liu; Junhong Dai; Yixuan Zhang; Shengyun Yin; Panshuo Li,2026-02-12,2026,arXiv,Traditional UAV VLN; Evaluation,High,https://arxiv.org/abs/2602.11735v1,https://arxiv.org/pdf/2602.11735v1,,,"((uav OR drone OR aerial) AND (""slam"" OR ""path planning"" OR ""obstacle avoidance"" OR ""semantic map""))"
c56d6813f3fd,2602.10704v2,(MGS)$^2$-Net: Unifying Micro-Geometric Scale and Macro-Geometric Structure for Cross-View Geo-Localization,Minglei Li; Mengfan He; Chunyu Li; Chao Chen; Xingyu Shao; Ziyang Meng,2026-02-11,2026,arXiv,Evaluation,Medium,https://arxiv.org/abs/2602.10704v2,https://arxiv.org/pdf/2602.10704v2,,,"""uav navigation"""
e06d0d2d78ac,2602.11291v2,H-WM: Robotic Task and Motion Planning Guided by Hierarchical World Model,Jinbang Huang; Wenyuan Chen; Zhiyuan Li; Oscar Pang; Xiao Hu; Lingfeng Zhang; Yuanzhao Hu; Zhanguang Zhang; Mark Coates; Tongtong Cao; Xingyue Quan; Yingxue Zhang,2026-02-11,2026,arXiv,Traditional UAV VLN,Low,https://arxiv.org/abs/2602.11291v2,https://arxiv.org/pdf/2602.11291v2,,,"""visual world model"""
d4b966ec199d,2602.10717v1,"Say, Dream, and Act: Learning Video World Models for Instruction-Driven Robot Manipulation",Songen Gu; Yunuo Cai; Tianyu Wang; Simo Wu; Yanwei Fu,2026-02-11,2026,arXiv,UAV WAM,Low,https://arxiv.org/abs/2602.10717v1,https://arxiv.org/pdf/2602.10717v1,,,"""video prediction"""
55c6f42e31a6,2602.09657v1,AutoFly: Vision-Language-Action Model for UAV Autonomous Navigation in the Wild,Xiaolou Sun; Wufei Si; Wenhui Ni; Yuntian Li; Dongming Wu; Fei Xie; Runwei Guan; He-Yang Xu; Henghui Ding; Yuan Wu; Yutao Yue; Yongming Huang; Hui Xiong,2026-02-10,2026,ICLR,UAV VLA; Traditional UAV VLN; Foundations,High,https://arxiv.org/abs/2602.09657v1,https://arxiv.org/pdf/2602.09657v1,,,"(""vision-language navigation"" AND (evaluation OR metric OR SPL OR ""success rate"" OR ""sim-to-real""))"
99309aafe56b,2602.08236v1,When and How Much to Imagine: Adaptive Test-Time Scaling with World Models for Visual Spatial Reasoning,Shoubin Yu; Yue Zhang; Zun Wang; Jaehong Yoon; Huaxiu Yao; Mingyu Ding; Mohit Bansal,2026-02-09,2026,arXiv,Foundations,Medium,https://arxiv.org/abs/2602.08236v1,https://arxiv.org/pdf/2602.08236v1,,,"""embodied navigation"""
07cfdb6e87ae,2602.08653v1,High-Speed Vision-Based Flight in Clutter with Safety-Shielded Reinforcement Learning,Jiarui Zhang; Chengyong Lei; Chengjiang Dai; Lijie Wang; Zhichao Han; Fei Gao,2026-02-09,2026,arXiv,Traditional UAV VLN,High,https://arxiv.org/abs/2602.08653v1,https://arxiv.org/pdf/2602.08653v1,,,"((uav OR drone OR aerial) AND (""slam"" OR ""path planning"" OR ""obstacle avoidance"" OR ""semantic map""))"
ea54825d9a4a,2602.07629v2,LCLA: Language-Conditioned Latent Alignment for Vision-Language Navigation,Nitesh Subedi; Adam Haroon; Samuel Tetteh; Prajwal Koirala; Cody Fleming; Soumik Sarkar,2026-02-07,2026,arXiv,Foundations,Medium,https://arxiv.org/abs/2602.07629v2,https://arxiv.org/pdf/2602.07629v2,,,"(""vision-language navigation"" AND (evaluation OR metric OR SPL OR ""success rate"" OR ""sim-to-real""))"
5723150b22ae,2602.07101v2,Zero-Shot UAV Navigation in Forests via Relightable 3D Gaussian Splatting,Zinan Lv; Yeqian Qian; Chen Sang; Hao Liu; Danping Zou; Ming Yang,2026-02-06,2026,arXiv,Evaluation,Medium,https://arxiv.org/abs/2602.07101v2,https://arxiv.org/pdf/2602.07101v2,,,"""uav navigation"""
934c646648d6,2602.06356v1,Nipping the Drift in the Bud: Retrospective Rectification for Robust Vision-Language Navigation,Gang He; Zhenyang Liu; Kepeng Xu; Li Xu; Tong Qiao; Wenxin Yu; Chang Wu; Weiying Xie,2026-02-06,2026,arXiv,Foundations; Evaluation,Medium,https://arxiv.org/abs/2602.06356v1,https://arxiv.org/pdf/2602.06356v1,,,"(""vision-language navigation"" AND (evaluation OR metric OR SPL OR ""success rate"" OR ""sim-to-real""))"
34f8862004e4,2602.06427v1,Bridging the Indoor-Outdoor Gap: Vision-Centric Instruction-Guided Embodied Navigation for the Last Meters,Yuxiang Zhao; Yirong Yang; Yanqing Zhu; Yanfen Shen; Chiyu Wang; Zhining Gu; Pei Shi; Wei Guo; Mu Xu,2026-02-06,2026,arXiv,Foundations; Evaluation,Medium,https://arxiv.org/abs/2602.06427v1,https://arxiv.org/pdf/2602.06427v1,,,"""embodied navigation"""
5609519daf89,2602.05552v1,VLN-Pilot: Large Vision-Language Model as an Autonomous Indoor Drone Operator,Bessie Dominguez-Dager; Sergio Suescun-Ferrandiz; Felix Escalona; Francisco Gomez-Donoso; Miguel Cazorla,2026-02-05,2026,arXiv,Foundations; Traditional UAV VLN; Evaluation,High,https://arxiv.org/abs/2602.05552v1,https://arxiv.org/pdf/2602.05552v1,,,"((uav OR drone OR aerial) AND (""instruction following"" OR ""language grounding"" OR ""language-conditioned navigation""))"
7cab917a80a4,2602.05827v1,Sparse Video Generation Propels Real-World Beyond-the-View Vision-Language Navigation,Hai Zhang; Siqi Liang; Li Chen; Yuxian Li; Yukuan Xu; Yichao Zhong; Fu Zhang; Hongyang Li,2026-02-05,2026,arXiv,Foundations,Medium,https://arxiv.org/abs/2602.05827v1,https://arxiv.org/pdf/2602.05827v1,,,"(""vision-language navigation"" AND (evaluation OR metric OR SPL OR ""success rate"" OR ""sim-to-real""))"
e5585d214a58,2602.05789v1,Allocentric Perceiver: Disentangling Allocentric Reasoning from Egocentric Visual Priors via Frame Instantiation,Hengyi Wang; Ruiqiang Zhang; Chang Liu; Guanjie Wang; Zehua Ma; Han Fang; Weiming Zhang,2026-02-05,2026,arXiv,Foundations,Medium,https://arxiv.org/abs/2602.05789v1,https://arxiv.org/pdf/2602.05789v1,,,"(""vision-language navigation"" AND (evaluation OR metric OR SPL OR ""success rate"" OR ""sim-to-real""))"
b14063650de3,2602.03201v3,SLOPE: Optimistic Potential Landscape Shaping for Model-based Reinforcement Learning,Yao-Hui Li; Zeyu Wang; Xin Li; Wei Pang; Yingfang Yuan; Zhengkun Chen; Boya Zhang; Riashat Islam; Alex Lamb; Yonggang Zhang,2026-02-03,2026,arXiv,UAV WAM,Low,https://arxiv.org/abs/2602.03201v3,https://arxiv.org/pdf/2602.03201v3,,,"""model-based reinforcement learning"""
ba4aba6cb2d2,2602.15875v1,Fly0: Decoupling Semantic Grounding from Geometric Planning for Zero-Shot Aerial Navigation,Zhenxing Xu; Brikit Lu; Weidong Bao; Zhengqiu Zhu; Junsong Zhang; Hui Yan; Wenhao Lu; Ji Wang,2026-02-02,2026,arXiv,Evaluation,Medium,https://arxiv.org/abs/2602.15875v1,https://arxiv.org/pdf/2602.15875v1,,,"""aerial navigation"""
efe5a4cc752e,2602.02459v1,TIC-VLA: A Think-in-Control Vision-Language-Action Model for Robot Navigation in Dynamic Environments,Zhiyu Huang; Yun Zhang; Johnson Liu; Rui Song; Chen Tang; Jiaqi Ma,2026-02-02,2026,arXiv,UAV VLA,Low,https://arxiv.org/abs/2602.02459v1,https://arxiv.org/pdf/2602.02459v1,,,"""language-guided navigation"""
31b6ee87a283,2602.01189v2,SPOT: Spatio-Temporal Obstacle-free Trajectory Planning for UAVs in an Unknown Dynamic Environment,Astik Srivastava; Thomas J Chackenkulam; Bitla Bhanu Teja; Antony Thomas; Madhava Krishna,2026-02-01,2026,ICRA,Traditional UAV VLN,High,https://arxiv.org/abs/2602.01189v2,https://arxiv.org/pdf/2602.01189v2,,,"""uav navigation"""
2abe3d7fdf47,2602.00222v2,MapDream: Task-Driven Map Learning for Vision-Language Navigation,Guoxin Lian; Shuo Wang; Yucheng Wang; Yongcai Wang; Maiyue Chen; Kaihui Wang; Bo Zhang; Zhizhong Su; Deying Li; Zhaoxin Fan,2026-01-30,2026,arXiv,Foundations,Medium,https://arxiv.org/abs/2602.00222v2,https://arxiv.org/pdf/2602.00222v2,,,"""vision language navigation"""
689800b15667,2602.11183v2,Mitigating Error Accumulation in Continuous Navigation via Memory-Augmented Kalman Filtering,Yin Tang; Jiawei Ma; Jinrui Zhang; Alex Jinpeng Wang; Deyu Zhang,2026-01-30,2026,ICML,Foundations; Datasets & Simulators,Medium,https://arxiv.org/abs/2602.11183v2,https://arxiv.org/pdf/2602.11183v2,,,"""vision language navigation"""
c455e9c05e81,2601.21751v1,Dynamic Topology Awareness: Breaking the Granularity Rigidity in Vision-Language Navigation,Jiankun Peng; Jianyuan Guo; Ying Xu; Yue Liu; Jiashuang Yan; Xuanwei Ye; Houhua Li; Xiaoming Wang,2026-01-29,2026,arXiv,Foundations,Medium,https://arxiv.org/abs/2601.21751v1,https://arxiv.org/pdf/2601.21751v1,,,"""vision language navigation"""
d5da805739b8,2602.00148v2,Learning Physics-Grounded 4D Dynamics with Neural Gaussian Force Fields,Shiqian Li; Ruihong Shen; Junfeng Ni; Chang Pan; Chi Zhang; Yixin Zhu,2026-01-29,2026,ICLR,Evaluation,Medium,https://arxiv.org/abs/2602.00148v2,https://arxiv.org/pdf/2602.00148v2,,,"""video prediction"""
ff20b2471cc2,2601.22149v2,DynaWeb: Model-Based Reinforcement Learning of Web Agents,Hang Ding; Peidong Liu; Junqiao Wang; Ziwei Ji; Meng Cao; Rongzhao Zhang; Lynn Ai; Eric Yang; Tianyu Shi; Lei Yu,2026-01-29,2026,arXiv,UAV WAM,Low,https://arxiv.org/abs/2601.22149v2,https://arxiv.org/pdf/2601.22149v2,,,"""model-based reinforcement learning"""
a521746723a2,2601.21306v2,The Surprising Difficulty of Search in Model-Based Reinforcement Learning,Wei-Di Chang; Mikael Henaff; Brandon Amos; Gregory Dudek; Scott Fujimoto,2026-01-29,2026,ICML,UAV WAM,Low,https://arxiv.org/abs/2601.21306v2,https://arxiv.org/pdf/2601.21306v2,,,"""model-based reinforcement learning"""
2876e293fe55,2601.21602v2,AIR-VLA: Vision-Language-Action Systems for Aerial Manipulation,Jianli Sun; Bin Tian; Qiyao Zhang; Chengxiang Li; Zihan Song; Zhiyong Cui; Yisheng Lv; Yonglin Tian,2026-01-29,2026,arXiv,UAV VLA,High,https://arxiv.org/abs/2601.21602v2,https://arxiv.org/pdf/2601.21602v2,,,"((uav OR drone OR aerial) AND (""vision-language-action"" OR ""language-conditioned policy"" OR ""action token""))"
fd019628991c,2601.18188v2,\textsc{NaVIDA}: Vision-Language Navigation with Inverse Dynamics Augmentation,Weiye Zhu; Zekai Zhang; Xiangchen Wang; Hewei Pan; Teng Wang; Tiantian Geng; Rongtao Xu; Feng Zheng,2026-01-26,2026,arXiv,Foundations; UAV VLA,Medium,https://arxiv.org/abs/2601.18188v2,https://arxiv.org/pdf/2601.18188v2,,,"(""vision-language navigation"" AND (evaluation OR metric OR SPL OR ""success rate"" OR ""sim-to-real""))"
7fe760e81edd,2601.18323v1,TC-IDM: Grounding Video Generation for Executable Zero-shot Robot Motion,Weishi Mi; Yong Bao; Xiaowei Chi; Xiaozhu Ju; Zhiyuan Qin; Kuangzhi Ge; Kai Tang; Peidong Jia; Shanghang Zhang; Jian Tang,2026-01-26,2026,arXiv,Evaluation,Medium,https://arxiv.org/abs/2601.18323v1,https://arxiv.org/pdf/2601.18323v1,,,"""generative world model"""
6bdf5a44b3d0,2601.18069v1,Diffusion Model-based Reinforcement Learning for Version Age of Information Scheduling: Average and Tail-Risk-Sensitive Control,Haoyuan Pan; Sizhao Chen; Zhaorui Wang; Tse-Tin Chan,2026-01-26,2026,arXiv,UAV WAM,Low,https://arxiv.org/abs/2601.18069v1,https://arxiv.org/pdf/2601.18069v1,,,"""model-based reinforcement learning"""
5fe10f4f6d38,2602.15864v1,ReasonNavi: Human-Inspired Global Map Reasoning for Zero-Shot Embodied Navigation,Yuzhuo Ao; Anbang Wang; Yu-Wing Tai; Chi-Keung Tang,2026-01-26,2026,arXiv,Foundations,Medium,https://arxiv.org/abs/2602.15864v1,https://arxiv.org/pdf/2602.15864v1,,,"""embodied navigation"""
6a6519b61d1d,2601.13976v2,FantasyVLN: Unified Multimodal Chain-of-Thought Reasoning for Vision-Language Navigation,Jing Zuo; Lingzhou Mu; Fan Jiang; Chengcheng Ma; Mu Xu; Yonggang Qi,2026-01-20,2026,arXiv,Foundations,Medium,https://arxiv.org/abs/2601.13976v2,https://arxiv.org/pdf/2601.13976v2,,,"(""vision-language navigation"" AND (evaluation OR metric OR SPL OR ""success rate"" OR ""sim-to-real""))"
1440166d455b,2601.13809v2,DroneVLA: VLA based Aerial Manipulation,Fawad Mehboob; Monijesu James; Amir Habel; Jeffrin Sam; Miguel Altamirano Cabrera; Dzmitry Tsetserukou,2026-01-20,2026,arXiv,UAV VLA,High,https://arxiv.org/abs/2601.13809v2,https://arxiv.org/pdf/2601.13809v2,,,"((uav OR drone OR aerial) AND (""vision-language-action"" OR ""language-conditioned policy"" OR ""action token""))"
ed8ca2fa6258,2601.12939v1,Active Inference-Driven World Modeling for Adaptive UAV Swarm Trajectory Design,Kaleem Arshid; Ali Krayani; Lucio Marcenaro; David Martin Gomez; Carlo Regazzoni,2026-01-19,2026,arXiv,Traditional UAV VLN,High,https://arxiv.org/abs/2601.12939v1,https://arxiv.org/pdf/2601.12939v1,,,"((uav OR drone OR aerial) AND (""world model"" OR ""future observation prediction"" OR ""model-based reinforcement learning""))"
b0c821f1f84b,2601.11078v1,Visual Marker Search for Autonomous Drone Landing in Diverse Urban Environments,Jiaohong Yao; Linfeng Liang; Yao Deng; Xi Zheng; Richard Han; Yuankai Qi,2026-01-16,2026,arXiv,Datasets & Simulators; Traditional UAV VLN; Evaluation,High,https://arxiv.org/abs/2601.11078v1,https://arxiv.org/pdf/2601.11078v1,,,"""aerial navigation"""
b17ee4e28875,2601.09111v2,Towards Open Environments and Instructions: General Vision-Language Navigation via Fast-Slow Interactive Reasoning,Yang Li; Aming Wu; Zihao Zhang; Yahong Han,2026-01-14,2026,CVPR,Foundations,Medium,https://arxiv.org/abs/2601.09111v2,https://arxiv.org/pdf/2601.09111v2,,,"""vision language navigation"""
3581d86e038a,2601.08665v1,VLingNav: Embodied Navigation with Adaptive Reasoning and Visual-Assisted Linguistic Memory,Shaoan Wang; Yuanfei Luo; Xingyu Chen; Aocheng Luo; Dongyue Li; Chang Liu; Sheng Chen; Yangang Zhang; Junzhi Yu,2026-01-13,2026,arXiv,Foundations,Medium,https://arxiv.org/abs/2601.08665v1,https://arxiv.org/pdf/2601.08665v1,,,"""embodied navigation"""
