id,arxiv_id,title,authors,date,year,venue,topics,uav_relevance,abs_url,pdf_url,code_url,project_url,query_source
febd698e9855,2511.09219v4,Planning in Branch-and-Bound: Model-Based Reinforcement Learning for Exact Combinatorial Optimization,Paul Strang; Zacharie Alès; Côme Bissuel; Olivier Juan; Safia Kedad-Sidhoum; Emmanuel Rachelson,2025-11-12,2025,arXiv,UAV WAM,Low,https://arxiv.org/abs/2511.09219v4,https://arxiv.org/pdf/2511.09219v4,,,"""model-based reinforcement learning"""
950d3a25dbf4,2511.08935v2,Expand Your SCOPE: Semantic Cognition over Potential-Based Exploration for Embodied Visual Navigation,Ningnan Wang; Weihuang Chen; Liming Chen; Haoxuan Ji; Zhongyu Guo; Xuchong Zhang; Hongbin Sun,2025-11-12,2025,arXiv,Traditional UAV VLN,Low,https://arxiv.org/abs/2511.08935v2,https://arxiv.org/pdf/2511.08935v2,,,"""embodied navigation"""
f9eeb983daac,2511.07710v3,Cross Modal Fine-Grained Alignment via Granularity-Aware and Region-Uncertain Modeling,Jiale Liu; Haoming Zhou; Yishu Liu; Bingzhi Chen; Yuncheng Jiang,2025-11-11,2025,arXiv,Foundations,Medium,https://arxiv.org/abs/2511.07710v3,https://arxiv.org/pdf/2511.07710v3,,,"""vision language navigation"""
a0f37dad6eda,2511.07732v2,ViPRA: Video Prediction for Robot Actions,Sandeep Routray; Hengkai Pan; Unnat Jain; Shikhar Bahl; Deepak Pathak,2025-11-11,2025,ICLR,UAV WAM,Low,https://arxiv.org/abs/2511.07732v2,https://arxiv.org/pdf/2511.07732v2,,,"""video prediction"""
52b5393c5a89,2511.06182v2,OpenVLN: Open-world Aerial Vision-Language Navigation,Peican Lin; Gan Sun; Chenxi Liu; Fazeng Li; Weihong Ren; Yang Cong,2025-11-09,2025,arXiv,Foundations; Evaluation; Traditional UAV VLN,High,https://arxiv.org/abs/2511.06182v2,https://arxiv.org/pdf/2511.06182v2,,,"(""vision-language navigation"" AND (evaluation OR metric OR SPL OR ""success rate"" OR ""sim-to-real""))"
cf330aa0642e,2511.03077v1,WorldPlanner: Monte Carlo Tree Search and MPC with Action-Conditioned Visual World Models,R. Khorrambakht; Joaquim Ortiz-Haro; Joseph Amigo; Omar Mostafa; Daniel Dugas; Franziska Meier; Ludovic Righetti,2025-11-04,2025,arXiv,UAV WAM,Low,https://arxiv.org/abs/2511.03077v1,https://arxiv.org/pdf/2511.03077v1,,,"""visual world model"""
491f43f92870,2511.00933v1,Fast-SmartWay: Panoramic-Free End-to-End Zero-Shot Vision-and-Language Navigation,Xiangyu Shi; Zerui Li; Yanyuan Qiao; Qi Wu,2025-11-02,2025,arXiv,Foundations,Medium,https://arxiv.org/abs/2511.00933v1,https://arxiv.org/pdf/2511.00933v1,,,"""embodied navigation"""
ffe0798ff6de,2510.27114v1,Learning Generalizable Visuomotor Policy through Dynamics-Alignment,Dohyeok Lee; Jung Min Lee; Munkyung Kim; Seokhun Ju; Jin Woo Koo; Kyungjae Lee; Dohyeong Kim; TaeHyun Cho; Jungwoo Lee,2025-10-31,2025,arXiv,UAV VLA,Low,https://arxiv.org/abs/2510.27114v1,https://arxiv.org/pdf/2510.27114v1,,,"""video prediction"""
466e595539b1,2510.26909v3,NaviTrace: Evaluating Embodied Navigation of Vision-Language Models,Tim Windecker; Manthan Patel; Moritz Reuss; Richard Schwarzkopf; Cesar Cadena; Rudolf Lioutikov; Marco Hutter; Jonas Frey,2025-10-30,2025,ICRA,Foundations; Evaluation,Medium,https://arxiv.org/abs/2510.26909v3,https://arxiv.org/pdf/2510.26909v3,,,"""embodied navigation"""
88cd48c46fb4,2510.25760v2,Multimodal Spatial Reasoning in the Large Model Era: A Survey and Benchmarks,Xu Zheng; Zihao Dongfang; Lutao Jiang; Boyuan Zheng; Yulong Guo; Zhenquan Zhang; Giuliano Albanese; Runyi Yang; Mengjiao Ma; Zixin Zhang; Chenfei Liao; Dingcheng Zhen; Yuanhuiyi Lyu; Yuqian Fu; Bin Ren; Linfeng Zhang; Danda Pani Paudel; Nicu Sebe; Luc Van Gool; Xuming Hu,2025-10-29,2025,arXiv,Foundations,Medium,https://arxiv.org/abs/2510.25760v2,https://arxiv.org/pdf/2510.25760v2,,,"(""vision-language navigation"" AND (evaluation OR metric OR SPL OR ""success rate"" OR ""sim-to-real""))"
a4f7565db105,2510.25191v3,SoraNav: Adaptive UAV Task-Centric Navigation via Zeroshot VLM Reasoning,Hongyu Song; Rishabh Dev Yadav; Cheng Guo; Wei Pan,2025-10-29,2025,arXiv,Foundations; Evaluation; Traditional UAV VLN,High,https://arxiv.org/abs/2510.25191v3,https://arxiv.org/pdf/2510.25191v3,,,"(""vision-language navigation"" AND (evaluation OR metric OR SPL OR ""success rate"" OR ""sim-to-real""))"
5c18a1ac8fb6,2510.24261v1,DynaRend: Learning 3D Dynamics via Masked Future Rendering for Robotic Manipulation,Jingyi Tian; Le Wang; Sanping Zhou; Sen Wang; Jiayi Li; Gang Hua,2025-10-28,2025,NeurIPS,Evaluation,Medium,https://arxiv.org/abs/2510.24261v1,https://arxiv.org/pdf/2510.24261v1,,,"""video prediction"""
d6337a762174,2510.21307v2,Towards Physically Executable 3D Gaussian for Embodied Navigation,Bingchen Miao; Rong Wei; Zhiqi Ge; Xiaoquan sun; Shiqi Gao; Jingzhe Zhu; Renhan Wang; Siliang Tang; Jun Xiao; Rui Tang; Juncheng Li,2025-10-24,2025,arXiv,Foundations; Evaluation,Medium,https://arxiv.org/abs/2510.21307v2,https://arxiv.org/pdf/2510.21307v2,,,"""embodied navigation"""
28734d307b1c,2510.20807v1,Video Prediction of Dynamic Physical Simulations With Pixel-Space Spatiotemporal Transformers,Dean L Slack; G Thomas Hudson; Thomas Winterbottom; Noura Al Moubayed,2025-10-23,2025,arXiv,UAV WAM,Low,https://arxiv.org/abs/2510.20807v1,https://arxiv.org/pdf/2510.20807v1,,,"""video prediction"""
a91a5e4d1f8d,2510.20818v1,VAMOS: A Hierarchical Vision-Language-Action Model for Capability-Modulated and Steerable Navigation,Mateo Guaman Castro; Sidharth Rajagopal; Daniel Gorbatov; Matt Schmittle; Rohan Baijal; Octi Zhang; Rosario Scalise; Sidharth Talia; Emma Romig; Celso de Melo; Byron Boots; Abhishek Gupta,2025-10-23,2025,arXiv,UAV VLA,Low,https://arxiv.org/abs/2510.20818v1,https://arxiv.org/pdf/2510.20818v1,,,"""embodied navigation"""
eadb3dfbb185,2510.19655v2,LaViRA: Language-Vision-Robot Actions Translation for Zero-Shot Vision Language Navigation in Continuous Environments,Hongyu Ding; Ziming Xu; Yudong Fang; You Wu; Zixuan Chen; Jieqi Shi; Jing Huo; Yifan Zhang; Yang Gao,2025-10-22,2025,ICRA,Foundations,Medium,https://arxiv.org/abs/2510.19655v2,https://arxiv.org/pdf/2510.19655v2,,,"""vision language navigation"""
3b824f7394cc,2510.18518v2,Efficient Model-Based Reinforcement Learning for Robot Control via Online Optimization,Fang Nan; Hao Ma; Qinghua Guan; Josie Hughes; Michael Muehlebach; Marco Hutter,2025-10-21,2025,arXiv,UAV WAM; Evaluation,Medium,https://arxiv.org/abs/2510.18518v2,https://arxiv.org/pdf/2510.18518v2,,,"""model-based reinforcement learning"""
02a69e9c3758,2510.21809v1,Embodied Navigation with Auxiliary Task of Action Description Prediction,Haru Kondoh; Asako Kanezaki,2025-10-21,2025,ICCV,Foundations,Medium,https://arxiv.org/abs/2510.21809v1,https://arxiv.org/pdf/2510.21809v1,,,"""embodied navigation"""
aee224e55919,2510.16624v1,Self-Supervised Learning to Fly using Efficient Semantic Segmentation and Metric Depth Estimation for Low-Cost Autonomous UAVs,Sebastian Mocanu; Emil Slusanschi; Marius Leordeanu,2025-10-18,2025,arXiv,Evaluation; Traditional UAV VLN,High,https://arxiv.org/abs/2510.16624v1,https://arxiv.org/pdf/2510.16624v1,,,"""drone navigation"""
0a35ba6d5c26,2510.15047v1,Internalizing World Models via Self-Play Finetuning for Agentic RL,Shiqi Chen; Tongyao Zhu; Zian Wang; Jinghan Zhang; Kangrui Wang; Siyang Gao; Teng Xiao; Yee Whye Teh; Junxian He; Manling Li,2025-10-16,2025,arXiv,Evaluation,Medium,https://arxiv.org/abs/2510.15047v1,https://arxiv.org/pdf/2510.15047v1,,,"""model-based reinforcement learning"""
6e4a390afa39,2510.14783v1,SkyDreamer: Interpretable End-to-End Vision-Based Drone Racing with Model-Based Reinforcement Learning,Aderik Verraest; Stavrow Bahnam; Robin Ferede; Guido de Croon; Christophe De Wagter,2025-10-16,2025,arXiv,UAV WAM; Evaluation,High,https://arxiv.org/abs/2510.14783v1,https://arxiv.org/pdf/2510.14783v1,,,"((uav OR drone OR aerial) AND (""world model"" OR ""future observation prediction"" OR ""model-based reinforcement learning""))"
44085c5a87e1,2510.13669v2,CanvasMAR: Improving Masked Autoregressive Video Prediction With Canvas,Zian Li; Muhan Zhang,2025-10-15,2025,arXiv,UAV WAM,Low,https://arxiv.org/abs/2510.13669v2,https://arxiv.org/pdf/2510.13669v2,,,"""video prediction"""
9bc1fbcc6740,2510.11501v1,Context-Aware Model-Based Reinforcement Learning for Autonomous Racing,Emran Yasser Moustafa; Ivana Dusparic,2025-10-13,2025,arXiv,UAV WAM; Evaluation,Medium,https://arxiv.org/abs/2510.11501v1,https://arxiv.org/pdf/2510.11501v1,,,"""model-based reinforcement learning"""
db4df3f56a60,2510.11760v1,Audio-Guided Visual Perception for Audio-Visual Navigation,Yi Wang; Yinfeng Yu; Fuchun Sun; Liejun Wang; Wendong Zheng,2025-10-13,2025,arXiv,Traditional UAV VLN; Evaluation,Medium,https://arxiv.org/abs/2510.11760v1,https://arxiv.org/pdf/2510.11760v1,,,"""embodied navigation"""
0ba123599f65,2510.10125v3,Ctrl-World: A Controllable Generative World Model for Robot Manipulation,Yanjiang Guo; Lucy Xiaoyang Shi; Jianyu Chen; Chelsea Finn,2025-10-11,2025,arXiv,UAV WAM,Low,https://arxiv.org/abs/2510.10125v3,https://arxiv.org/pdf/2510.10125v3,,,"""generative world model"""
b6f9635f6d8b,2510.08173v2,NavSpace: How Navigation Agents Follow Spatial Intelligence Instructions,Haolin Yang; Yuxing Long; Zhuoyuan Yu; Zihan Yang; Minghan Wang; Jiapeng Xu; Yihan Wang; Ziyan Yu; Wenzhe Cai; Lei Kang; Hao Dong,2025-10-09,2025,ICRA,Foundations,Medium,https://arxiv.org/abs/2510.08173v2,https://arxiv.org/pdf/2510.08173v2,,,"""embodied navigation"""
247c0ac9508e,2510.08713v2,Towards Unified World Models for Visual Navigation via Memory-Augmented Planning and Foresight,Yifei Dong; Fengyi Wu; Guangyu Chen; Lingdong Kong; Xu Zhu; Qiyu Hu; Yuxuan Zhou; Jingdong Sun; Jun-Yan He; Qi Dai; Alexander G. Hauptmann; Zhi-Qi Cheng,2025-10-09,2025,arXiv,Traditional UAV VLN; Evaluation,Medium,https://arxiv.org/abs/2510.08713v2,https://arxiv.org/pdf/2510.08713v2,,,"""embodied navigation"""
0c67df59eb9a,2510.07092v1,Generative World Modelling for Humanoids: 1X World Model Challenge Technical Report,Riccardo Mereu; Aidan Scannell; Yuxin Hou; Yi Zhao; Aditya Jitta; Antonio Dominguez; Luigi Acerbi; Amos Storkey; Paul Chang,2025-10-08,2025,arXiv,UAV WAM,Low,https://arxiv.org/abs/2510.07092v1,https://arxiv.org/pdf/2510.07092v1,,,"""generative world model"""
f66ef790ef29,2510.05957v1,Learning to Crawl: Latent Model-Based Reinforcement Learning for Soft Robotic Adaptive Locomotion,Vaughn Gzenda; Robin Chhabra,2025-10-07,2025,arXiv,UAV WAM,High,https://arxiv.org/abs/2510.05957v1,https://arxiv.org/pdf/2510.05957v1,,,"""model-based reinforcement learning"""
089bd534ef74,2510.04020v3,Spatiotemporal Forecasting as Planning: A Model-Based Reinforcement Learning Approach with Generative World Models,Hao Wu; Yuan Gao; Xingjian Shi; Shuaipeng Li; Fan Xu; Fan Zhang; Zhihong Zhu; Weiyan Wang; Xiao Luo; Kun Wang; Xian Wu; Xiaomeng Huang,2025-10-05,2025,arXiv,UAV WAM,Low,https://arxiv.org/abs/2510.04020v3,https://arxiv.org/pdf/2510.04020v3,,,"""model-based reinforcement learning"""
99c0e76f2bec,2510.03545v1,SketchPlan: Diffusion Based Drone Planning From Human Sketches,Sixten Norelius; Aaron O. Feldman; Mac Schwager,2025-10-03,2025,arXiv,Evaluation; Datasets & Simulators,Medium,https://arxiv.org/abs/2510.03545v1,https://arxiv.org/pdf/2510.03545v1,,,"""drone navigation"""
c5ca3342ecd5,2510.02248v1,Performance-Guided Refinement for Visual Aerial Navigation using Editable Gaussian Splatting in FalconGym 2.0,Yan Miao; Ege Yuceel; Georgios Fainekos; Bardh Hoxha; Hideki Okamoto; Sayan Mitra,2025-10-02,2025,arXiv,Evaluation,Medium,https://arxiv.org/abs/2510.02248v1,https://arxiv.org/pdf/2510.02248v1,,,"""aerial navigation"""
e5d0189176cf,2510.01348v2,Kilometer-Scale GNSS-Denied UAV Navigation via Heightmap Gradients: A Winning System from the SPRIN-D Challenge,Michal Werner; David Čapek; Tomáš Musil; Ondřej Franěk; Tomáš Báča; Martin Saska,2025-10-01,2025,arXiv,Traditional UAV VLN,High,https://arxiv.org/abs/2510.01348v2,https://arxiv.org/pdf/2510.01348v2,,,"""uav navigation"""
44674f7fa700,2510.01388v1,VENTURA: Adapting Image Diffusion Models for Unified Task Conditioned Navigation,Arthur Zhang; Xiangyun Meng; Luca Calliari; Dong-Ki Kim; Shayegan Omidshafiei; Joydeep Biswas; Ali Agha; Amirreza Shaban,2025-10-01,2025,arXiv,Traditional UAV VLN; Evaluation; Foundations,Medium,https://arxiv.org/abs/2510.01388v1,https://arxiv.org/pdf/2510.01388v1,,,"(""vision-language navigation"" AND (evaluation OR metric OR SPL OR ""success rate"" OR ""sim-to-real""))"
6981ef0a9291,2510.00604v1,Disentangling Foreground and Background for vision-Language Navigation via Online Augmentation,Yunbo Xu; Xuesong Zhang; Jia Li; Zhenzhen Hu; Richang Hong,2025-10-01,2025,arXiv,Foundations,Medium,https://arxiv.org/abs/2510.00604v1,https://arxiv.org/pdf/2510.00604v1,,,"""vision language navigation"""
afd1e46fb067,2510.01457v4,A Forensic Analysis of Synthetic Data in RL: Diagnosing and Solving Algorithmic Failures in Model-Based Policy Optimization,Brett Barkley; David Fridovich-Keil,2025-10-01,2025,arXiv,UAV WAM,Low,https://arxiv.org/abs/2510.01457v4,https://arxiv.org/pdf/2510.01457v4,,,"""model-based reinforcement learning"""
105fa984caa3,2509.25687v3,OmniNav: A Unified Framework for Prospective Exploration and Visual-Language Navigation,Xinda Xue; Junjun Hu; Minghua Luo; Shichao Xie; Jintao Chen; Zixun Xie; Kuichen Quan; Wei Guo; Mu Xu; Zedong Chu,2025-09-30,2025,arXiv,Foundations; Evaluation,Medium,https://arxiv.org/abs/2509.25687v3,https://arxiv.org/pdf/2509.25687v3,,,"""embodied navigation"""
9f719beae172,2509.24910v2,Learning Goal-Oriented Vision-and-Language Navigation with Self-Improving Demonstrations at Scale,Songze Li; Zun Wang; Gengze Zhou; Jialu Li; Xiangyu Zeng; Ziyang Gong; Limin Wang; Yu Qiao; Qi Wu; Mohit Bansal; Yi Wang,2025-09-29,2025,arXiv,Foundations; Evaluation; Datasets & Simulators,Medium,https://arxiv.org/abs/2509.24910v2,https://arxiv.org/pdf/2509.24910v2,,,"(""vision-language navigation"" AND (evaluation OR metric OR SPL OR ""success rate"" OR ""sim-to-real""))"
48f089b3d656,2509.24387v1,AdaNav: Adaptive Reasoning with Uncertainty for Vision-Language Navigation,Xin Ding; Jianyu Wei; Yifan Yang; Shiqi Jiang; Qianxi Zhang; Hao Wu; Fucheng Jia; Liang Mi; Yuxuan Yan; Weijun Wang; Yunxin Liu; Zhibo Chen; Ting Cao,2025-09-29,2025,arXiv,Foundations,Medium,https://arxiv.org/abs/2509.24387v1,https://arxiv.org/pdf/2509.24387v1,,,"(""vision-language navigation"" AND (evaluation OR metric OR SPL OR ""success rate"" OR ""sim-to-real""))"
c03adcdf9013,2509.24321v1,SONAR: Semantic-Object Navigation with Aggregated Reasoning through a Cross-Modal Inference Paradigm,Yao Wang; Zhirui Sun; Wenzheng Chi; Baozhi Jia; Wenjun Xu; Jiankun Wang,2025-09-29,2025,arXiv,Foundations; Evaluation; Datasets & Simulators,Medium,https://arxiv.org/abs/2509.24321v1,https://arxiv.org/pdf/2509.24321v1,,,"(""vision-language navigation"" AND (evaluation OR metric OR SPL OR ""success rate"" OR ""sim-to-real""))"
bcfa4375016b,2509.24804v1,DyMoDreamer: World Modeling with Dynamic Modulation,Boxuan Zhang; Runqing Wang; Wei Xiao; Weipu Zhang; Jian Sun; Gao Huang; Jie Chen; Gang Wang,2025-09-29,2025,arXiv,UAV WAM,Low,https://arxiv.org/abs/2509.24804v1,https://arxiv.org/pdf/2509.24804v1,,,"""model-based reinforcement learning"""
13b96c226ee2,2509.22653v1,"See, Point, Fly: A Learning-Free VLM Framework for Universal Unmanned Aerial Navigation",Chih Yao Hu; Yang-Sen Lin; Yuna Lee; Chih-Hai Su; Jie-Ying Lee; Shr-Ruei Tsai; Chin-Yang Lin; Kuan-Wen Chen; Tsung-Wei Ke; Yu-Lun Liu,2025-09-26,2025,CoRL,UAV VLA; Foundations; Evaluation,High,https://arxiv.org/abs/2509.22653v1,https://arxiv.org/pdf/2509.22653v1,,,"""aerial navigation"""
db702abfedf4,2509.22548v2,JanusVLN: Decoupling Semantics and Spatiality with Dual Implicit Memory for Vision-Language Navigation,Shuang Zeng; Dekang Qi; Xinyuan Chang; Feng Xiong; Shichao Xie; Xiaolong Wu; Shiyi Liang; Mu Xu; Xing Wei; Ning Guo,2025-09-26,2025,ICLR,Foundations; Evaluation,Medium,https://arxiv.org/abs/2509.22548v2,https://arxiv.org/pdf/2509.22548v2,,,"(""vision-language navigation"" AND (evaluation OR metric OR SPL OR ""success rate"" OR ""sim-to-real""))"
d31a335c06aa,2509.21797v3,MoWM: Mixture-of-World-Models for Embodied Planning via Latent-to-Pixel Feature Modulation,Yangcheng Yu; Xin Jin; Yu Shang; Xin Zhang; Haisheng Su; Wei Wu; Yong Li,2025-09-26,2025,arXiv,Evaluation,Medium,https://arxiv.org/abs/2509.21797v3,https://arxiv.org/pdf/2509.21797v3,,,"""generative world model"""
54df73fde493,2509.20869v2,Model-Based Reinforcement Learning under Random Observation Delays,Armin Karamzade; Kyungmin Kim; JB Lanier; Davide Corsi; Roy Fox,2025-09-25,2025,arXiv,UAV WAM,Low,https://arxiv.org/abs/2509.20869v2,https://arxiv.org/pdf/2509.20869v2,,,"""model-based reinforcement learning"""
0fae115c9b18,2509.20499v1,Boosting Zero-Shot VLN via Abstract Obstacle Map-Based Waypoint Prediction with TopoGraph-and-VisitInfo-Aware Prompting,Boqi Li; Siyuan Li; Weiyi Wang; Anran Li; Zhong Cao; Henry X. Liu,2025-09-24,2025,arXiv,Foundations,Medium,https://arxiv.org/abs/2509.20499v1,https://arxiv.org/pdf/2509.20499v1,,,"(""vision-language navigation"" AND (evaluation OR metric OR SPL OR ""success rate"" OR ""sim-to-real""))"
c2095d6bb61c,2509.18610v1,SINGER: An Onboard Generalist Vision-Language Navigation Policy for Drones,Maximilian Adang; JunEn Low; Ola Shorinwa; Mac Schwager,2025-09-23,2025,arXiv,Foundations; Evaluation,Medium,https://arxiv.org/abs/2509.18610v1,https://arxiv.org/pdf/2509.18610v1,,,"(""vision-language navigation"" AND (evaluation OR metric OR SPL OR ""success rate"" OR ""sim-to-real""))"
177aed149536,2509.18592v1,VLN-Zero: Rapid Exploration and Cache-Enabled Neurosymbolic Vision-Language Planning for Zero-Shot Transfer in Robot Navigation,Neel P. Bhatt; Yunhao Yang; Rohan Siva; Pranay Samineni; Daniel Milan; Zhangyang Wang; Ufuk Topcu,2025-09-23,2025,arXiv,Foundations; Evaluation,Medium,https://arxiv.org/abs/2509.18592v1,https://arxiv.org/pdf/2509.18592v1,,,"(""vision-language navigation"" AND (evaluation OR metric OR SPL OR ""success rate"" OR ""sim-to-real""))"
8019cea705ac,2509.21377v1,Dynamic Multi-Target Fusion for Efficient Audio-Visual Navigation,Yinfeng Yu; Hailong Zhang; Meiling Zhu,2025-09-23,2025,arXiv,Traditional UAV VLN; Evaluation,Medium,https://arxiv.org/abs/2509.21377v1,https://arxiv.org/pdf/2509.21377v1,,,"""embodied navigation"""
6930815b02b8,2509.17435v1,GPS Denied IBVS-Based Navigation and Collision Avoidance of UAV Using a Low-Cost RGB Camera,Xiaoyu Wang; Yan Rui Tan; William Leong; Sunan Huang; Rodney Teo; Cheng Xiang,2025-09-22,2025,arXiv,Traditional UAV VLN,High,https://arxiv.org/abs/2509.17435v1,https://arxiv.org/pdf/2509.17435v1,,,"""uav navigation"""
c4e2869ced02,2509.17340v2,AERO-MPPI: Anchor-Guided Ensemble Trajectory Optimization for Agile Mapless Drone Navigation,Xin Chen; Rui Huang; Longbin Tang; Lin Zhao,2025-09-22,2025,ICRA,Traditional UAV VLN,High,https://arxiv.org/abs/2509.17340v2,https://arxiv.org/pdf/2509.17340v2,,,"""drone navigation"""
2c4b7b924e54,2509.18200v1,Conversational Orientation Reasoning: Egocentric-to-Allocentric Navigation with Multimodal Chain-of-Thought,Yu Ti Huang,2025-09-20,2025,arXiv,Foundations,Medium,https://arxiv.org/abs/2509.18200v1,https://arxiv.org/pdf/2509.18200v1,,,"""embodied navigation"""
7bdbd6ae0eee,2509.15536v2,SAMPO:Scale-wise Autoregression with Motion PrOmpt for generative world models,Sen Wang; Jingyi Tian; Le Wang; Zhimin Liao; Jiayi Li; Huaiyi Dong; Kun Xia; Sanping Zhou; Wei Tang; Hua Gang,2025-09-19,2025,arXiv,UAV WAM,Low,https://arxiv.org/abs/2509.15536v2,https://arxiv.org/pdf/2509.15536v2,,,"""video prediction"""
eaa268006eb5,2509.13943v1,Reinforcement Learning for Autonomous Point-to-Point UAV Navigation,Salim Oyinlola; Nitesh Subedi; Soumik Sarkar,2025-09-17,2025,arXiv,Traditional UAV VLN,High,https://arxiv.org/abs/2509.13943v1,https://arxiv.org/pdf/2509.13943v1,,,"""uav navigation"""
cb7affdddf71,2509.13816v2,Agile in the Face of Delay: Asynchronous End-to-End Learning for Real-World Aerial Navigation,Yude Li; Zhexuan Zhou; Huizhe Li; Youmin Gong; Jie Mei,2025-09-17,2025,arXiv,Datasets & Simulators; Traditional UAV VLN,High,https://arxiv.org/abs/2509.13816v2,https://arxiv.org/pdf/2509.13816v2,,,"""aerial navigation"""
2bdb3fe4c41a,2509.13733v3,FSR-VLN: Fast and Slow Reasoning for Vision-Language Navigation with Hierarchical Multi-modal Scene Graph,Xiaolin Zhou; Tingyang Xiao; Liu Liu; Yucheng Wang; Maiyue Chen; Xinrui Meng; Xinjie Wang; Wei Feng; Wei Sui; Zhizhong Su,2025-09-17,2025,arXiv,Foundations,Medium,https://arxiv.org/abs/2509.13733v3,https://arxiv.org/pdf/2509.13733v3,,,"(""vision-language navigation"" AND (evaluation OR metric OR SPL OR ""success rate"" OR ""sim-to-real""))"
5750ba78286f,2509.11959v1,Learning to Generate 4D LiDAR Sequences,Ao Liang; Youquan Liu; Yu Yang; Dongyue Lu; Linfeng Li; Lingdong Kong; Huaici Zhao; Wei Tsang Ooi,2025-09-15,2025,ICCV,Evaluation,Medium,https://arxiv.org/abs/2509.11959v1,https://arxiv.org/pdf/2509.11959v1,,,"""generative world model"""
dcaee7af73e9,2509.12129v2,Embodied Navigation Foundation Model,Jiazhao Zhang; Anqi Li; Yunpeng Qi; Minghan Li; Jiahang Liu; Shaoan Wang; Haoran Liu; Gengze Zhou; Yuze Wu; Xingxing Li; Yuxin Fan; Wenjun Li; Zhibo Chen; Fei Gao; Qi Wu; Zhizheng Zhang; He Wang,2025-09-15,2025,arXiv,Foundations,Medium,https://arxiv.org/abs/2509.12129v2,https://arxiv.org/pdf/2509.12129v2,,,"""embodied navigation"""
1e24461b37f4,2509.10730v1,A Survey on LiDAR-based Autonomous Aerial Vehicles,Yunfan Ren; Yixi Cai; Haotian Li; Nan Chen; Fangcheng Zhu; Longji Yin; Fanze Kong; Rundong Li; Fu Zhang,2025-09-12,2025,arXiv,Traditional UAV VLN,High,https://arxiv.org/abs/2509.10730v1,https://arxiv.org/pdf/2509.10730v1,,,"""uav navigation"""
a77d04e499b1,2509.08159v1,Zero-Shot Metric Depth Estimation via Monocular Visual-Inertial Rescaling for Autonomous Aerial Navigation,Steven Yang; Xiaoyu Tian; Kshitij Goel; Wennie Tabib,2025-09-09,2025,arXiv,Evaluation; Traditional UAV VLN,High,https://arxiv.org/abs/2509.08159v1,https://arxiv.org/pdf/2509.08159v1,,,"""aerial navigation"""
aaa5af0804ad,2509.04731v3,Generative World Models of Tasks: LLM-Driven Hierarchical Scaffolding for Embodied Agents,Brennen Hill,2025-09-05,2025,NeurIPS,UAV WAM,Low,https://arxiv.org/abs/2509.04731v3,https://arxiv.org/pdf/2509.04731v3,,,"""generative world model"""
447b3b221463,2508.19852v2,Ego-centric Predictive Model Conditioned on Hand Trajectories,Binjie Zhang; Mike Zheng Shou,2025-08-27,2025,arXiv,UAV VLA,Low,https://arxiv.org/abs/2508.19852v2,https://arxiv.org/pdf/2508.19852v2,,,"""video prediction"""
f277fdfbef66,2508.15354v1,"Sensing, Social, and Motion Intelligence in Embodied Navigation: A Comprehensive Survey",Chaoran Xiong; Yulong Huang; Fangwen Yu; Changhao Chen; Yue Wang; Songpengchen Xia; Ling Pei,2025-08-21,2025,arXiv,Foundations; Evaluation,Medium,https://arxiv.org/abs/2508.15354v1,https://arxiv.org/pdf/2508.15354v1,,,"""embodied navigation"""
dfba666af1b9,2508.12394v2,SIGN: Safety-Aware Image-Goal Navigation for Autonomous Drones via Reinforcement Learning,Zichen Yan; Rui Huang; Lei He; Shao Guo; Lin Zhao,2025-08-17,2025,arXiv,Traditional UAV VLN,High,https://arxiv.org/abs/2508.12394v2,https://arxiv.org/pdf/2508.12394v2,,,"""drone navigation"""
37476e67d1bb,2508.09444v1,DAgger Diffusion Navigation: DAgger Boosted Diffusion Policy for Vision-Language Navigation,Haoxiang Shi; Xiang Deng; Zaijing Li; Gongwei Chen; Yaowei Wang; Liqiang Nie,2025-08-13,2025,arXiv,Foundations; UAV VLA,Medium,https://arxiv.org/abs/2508.09444v1,https://arxiv.org/pdf/2508.09444v1,,,"""vision language navigation"""
171cc2f5d19c,2508.09561v1,"Edge General Intelligence Through World Models and Agentic AI: Fundamentals, Solutions, and Challenges",Changyuan Zhao; Guangyuan Liu; Ruichen Zhang; Yinqiu Liu; Jiacheng Wang; Jiawen Kang; Dusit Niyato; Zan Li; Xuemin; Shen; Zhu Han; Sumei Sun; Chau Yuen; Dong In Kim,2025-08-13,2025,arXiv,UAV WAM,High,https://arxiv.org/abs/2508.09561v1,https://arxiv.org/pdf/2508.09561v1,,,"((uav OR drone OR aerial) AND (""world model"" OR ""future observation prediction"" OR ""model-based reinforcement learning""))"
27f68bd60cb4,2508.06944v3,AMFT: Aligning LLM Reasoners by Meta-Learning the Optimal Imitation-Exploration Balance,Lixuan He; Jie Feng; Yong Li,2025-08-09,2025,arXiv,Foundations,Medium,https://arxiv.org/abs/2508.06944v3,https://arxiv.org/pdf/2508.06944v3,,,"(""vision-language navigation"" AND (evaluation OR metric OR SPL OR ""success rate"" OR ""sim-to-real""))"
3774ba6ba7aa,2508.06335v1,ViPro-2: Unsupervised State Estimation via Integrated Dynamics for Guiding Video Prediction,Patrick Takenaka; Johannes Maucher; Marco F. Huber,2025-08-08,2025,arXiv,UAV WAM,Low,https://arxiv.org/abs/2508.06335v1,https://arxiv.org/pdf/2508.06335v1,,,"""video prediction"""
3a75968245a9,2508.05855v1,Safety of Embodied Navigation: A Survey,Zixia Wang; Jia Hu; Ronghui Mu,2025-08-07,2025,arXiv,Foundations; Evaluation,Medium,https://arxiv.org/abs/2508.05855v1,https://arxiv.org/pdf/2508.05855v1,,,"""embodied navigation"""
9b1dd606e258,2508.04598v1,"$NavA^3$: Understanding Any Instruction, Navigating Anywhere, Finding Anything",Lingfeng Zhang; Xiaoshuai Hao; Yingbo Tang; Haoxiang Fu; Xinyu Zheng; Pengwei Wang; Zhongyuan Wang; Wenbo Ding; Shanghang Zhang,2025-08-06,2025,arXiv,Foundations,Medium,https://arxiv.org/abs/2508.04598v1,https://arxiv.org/pdf/2508.04598v1,,,"""embodied navigation"""
7044eb48ba89,2508.03692v3,LiDARCrafter: Dynamic 4D World Modeling from LiDAR Sequences,Ao Liang; Youquan Liu; Yu Yang; Dongyue Lu; Linfeng Li; Lingdong Kong; Huaici Zhao; Wei Tsang Ooi,2025-08-05,2025,arXiv,Datasets & Simulators; Evaluation,Medium,https://arxiv.org/abs/2508.03692v3,https://arxiv.org/pdf/2508.03692v3,,,"""generative world model"""
