id,arxiv_id,title,authors,date,year,venue,topics,uav_relevance,abs_url,pdf_url,code_url,project_url,query_source
7a3f55831a40,2605.29647v1,MARTIAN: A Rendering Framework for Aerial Mars Imagery from HiRISE Orbital Data,Dario Pisanti; Georgios Georgakis,2026-05-28,2026,arXiv,Datasets & Simulators,Medium,https://arxiv.org/abs/2605.29647v1,https://arxiv.org/pdf/2605.29647v1,,,"((uav OR drone OR aerial) AND (evaluation OR metric OR ""success rate"" OR collision OR ""OOD generalization""))"
8ace2cd4debd,2605.30282v1,Gaze2Act: Gaze-Conditioned Vision-Language-Action Policies for Interactive Robot Manipulation,Kuangji Zuo; Gen Li; Bofan Lyu; Yanshuo Lu; Boyu Ma; Shijia Han; Xinyu Zhou; Xichen Yuan; Chuhao Zhou; Jiaqi Bai; Geng Li; Jianfei Yang,2026-05-28,2026,arXiv,UAV VLA; Evaluation,Medium,https://arxiv.org/abs/2605.30282v1,https://arxiv.org/pdf/2605.30282v1,,,"(""vision-language-action"" OR ""vision language action"" OR ""openvla"" OR ""rt-2"" OR ""octo"")"
a066b821190c,2605.30280v1,"Qwen-VLA: Unifying Vision-Language-Action Modeling across Tasks, Environments, and Robot Embodiments",Qiuyue Wang; Mingsheng Li; Jian Guan; Jinhui Ye; Sicheng Xie; Yitao Liu; Junhao Chen; Zhixuan Liang; Jie Zhang; Xintong Hu; Xuhong Huang; Pei Lin; Junyang Lin; Dayiheng Liu; Shuai Bai; Jingren Zhou; Jiazhao Zhang; Haoqi Yuan; Gengze Zhou; Hang Yin; Ye Wang; Yiyang Huang; Zixing Lei; Wujian Peng; Delin Chen; Yingming Zheng; Jingyang Fan; Xianwei Zhuang; Xin Zhou; Haoyang Li; Anzhe Chen; Tong Zhang; Xuejing Liu; Yuchong Sun; Ruizhe Chen; Zhaohai Li; Chenxu Lü; Zhibo Yang; Tao Yu; Xionghui Chen,2026-05-28,2026,arXiv,UAV VLA; Foundations,Medium,https://arxiv.org/abs/2605.30280v1,https://arxiv.org/pdf/2605.30280v1,,,"(""vision-language-action"" OR ""vision language action"" OR ""openvla"" OR ""rt-2"" OR ""octo"")"
063ca1bc3bf6,2605.30226v1,BORA: Bridging Offline Reinforcement Learning and Online Residual Adaptation for Real-World Dexterous VLA Models,Zhongxi Chen; Yifan Han; Yanming Shao; Huanming Liu; Congsheng Xu; Xiaoyu Chen; Yao Mu; Wenzhao Lian,2026-05-28,2026,arXiv,Evaluation; UAV VLA,Medium,https://arxiv.org/abs/2605.30226v1,https://arxiv.org/pdf/2605.30226v1,,,"(""vision-language-action"" OR ""vision language action"" OR ""openvla"" OR ""rt-2"" OR ""octo"")"
834912594758,2605.30117v1,VLA-Trace: Diagnosing Vision-Language-Action Models through Representation and Behavior Tracing,Haoyuan Shi; Xiancong Ren; Yingji Zhang; Qinfan Zhang; Jiayu Hu; Haozhe Shan; Han Dong; Jinpeng Lu; Yinda Chen; Yi Zhang; Yong Dai; Xiaozhu Ju,2026-05-28,2026,arXiv,UAV VLA,Low,https://arxiv.org/abs/2605.30117v1,https://arxiv.org/pdf/2605.30117v1,,,"(""vision-language-action"" OR ""vision language action"" OR ""openvla"" OR ""rt-2"" OR ""octo"")"
054f7f9818cf,2605.30011v1,VisualThink-VLA: Visual Intermediate Reasoning for Effective and Low-Latency Vision-Language-Action Policies,Mingjian Gao; Wenqiao Zhang; Yuqian Yuan; Yang Dai; Binhe Yu; Zheqi Lv; Haoyu Zheng; Jiaqi Zhu; Zhiqi Ge; Zixuan Wan; Siliang Tang; Yueting Zhuang,2026-05-28,2026,arXiv,UAV VLA; Evaluation,Medium,https://arxiv.org/abs/2605.30011v1,https://arxiv.org/pdf/2605.30011v1,,,"(""vision-language-action"" OR ""vision language action"" OR ""openvla"" OR ""rt-2"" OR ""octo"")"
6d334d7b3410,2605.29710v1,PhAIL: A Real-Robot VLA Benchmark and Distributional Methodology,Sergey Arkhangelskiy,2026-05-28,2026,arXiv,Evaluation,Medium,https://arxiv.org/abs/2605.29710v1,https://arxiv.org/pdf/2605.29710v1,,,"(""vision-language-action"" OR ""vision language action"" OR ""openvla"" OR ""rt-2"" OR ""octo"")"
9624c4cb501b,2605.29662v1,SAFE-Pruner: Semantic Attention-Guided Future-Aware Token Pruning for Efficient Vision-Language-Action Manipulation,Shilin Ma; Chubin Zhang; Changyuan Wang; Yuji Wang; Yue Wu; Zixuan Wang; Jingqi Tian; Zheng Zhu; Yansong Tang,2026-05-28,2026,arXiv,UAV VLA,Low,https://arxiv.org/abs/2605.29662v1,https://arxiv.org/pdf/2605.29662v1,,,"(""vision-language-action"" OR ""vision language action"" OR ""openvla"" OR ""rt-2"" OR ""octo"")"
a145d982b999,2605.29605v1,VLAConf: Calibrated Task-Success Confidence for Vision-Language-Action Models,Dehao Huang; Aoxiang Gu; Chengjie Zhang; Bolin Zou; Wenlong Dong; Zilang Cen; Yue Wang; Hong Zhang,2026-05-28,2026,arXiv,UAV VLA,Low,https://arxiv.org/abs/2605.29605v1,https://arxiv.org/pdf/2605.29605v1,,,"(""vision-language-action"" OR ""vision language action"" OR ""openvla"" OR ""rt-2"" OR ""octo"")"
2995a53defb1,2605.29577v1,Mitigating State Aliasing in Vision-Language-Action Models via Inverse Dynamics Learning,Kyujin Lee; Injae Kim; Jihwan Park; Yejun Ju; Minseok Joo; Hyunwoo J. Kim,2026-05-28,2026,arXiv,UAV VLA,Low,https://arxiv.org/abs/2605.29577v1,https://arxiv.org/pdf/2605.29577v1,,,"(""vision-language-action"" OR ""vision language action"" OR ""openvla"" OR ""rt-2"" OR ""octo"")"
62857671a8eb,2605.29562v1,VLA-Pro: Cross-Task Procedural Memory Transfer for Vision-Language-Action Models,Shengyu Si; Yuanzhuo Lu; Ruimeng Yang; Ziyi Ye; Zuxuan Wu; Yu-Gang Jiang,2026-05-28,2026,arXiv,UAV VLA; Evaluation,Medium,https://arxiv.org/abs/2605.29562v1,https://arxiv.org/pdf/2605.29562v1,,,"(""vision-language-action"" OR ""vision language action"" OR ""openvla"" OR ""rt-2"" OR ""octo"")"
296a1c47eeec,2605.29438v1,ElegantVLA: Learning When to Think for Efficient Vision-Language-Action Models,Ye Li; Huanan Liu; Kangye Ji; Yuan Meng; Jiajun Fan; Yuansong Wang; Shiyu Qin; Chenglei Wu; Shu-Tao Xia; Zhi Wang,2026-05-28,2026,arXiv,UAV VLA,Low,https://arxiv.org/abs/2605.29438v1,https://arxiv.org/pdf/2605.29438v1,,,"(""vision-language-action"" OR ""vision language action"" OR ""openvla"" OR ""rt-2"" OR ""octo"")"
2facca50052a,2605.29416v1,3DVLA: Enhancing Vision-Language-Action Models via 3D Spatial and Instance Understanding,Zhongyu Xia; Yousen Tang; Bingqing Wei; Yongtao Wang,2026-05-28,2026,arXiv,UAV VLA,Low,https://arxiv.org/abs/2605.29416v1,https://arxiv.org/pdf/2605.29416v1,,,"(""vision-language-action"" OR ""vision language action"" OR ""openvla"" OR ""rt-2"" OR ""octo"")"
b33218fb6eda,2605.29360v1,MiraBench: Evaluating Action-Conditioned Reliability in Robotic World Models,Tianzhuo Yang; Zihan Shen; Zirui Mi; Zhaoyi Zhang; Jiayi Zhou; Jiaming Ji; Juntao Dai; Jiawei Chen; Boyuan Chen; Yaodong Yang,2026-05-28,2026,arXiv,UAV WAM,Low,https://arxiv.org/abs/2605.29360v1,https://arxiv.org/pdf/2605.29360v1,,,"(""world action model"" OR ""action-conditioned world model"" OR ""video world model"" OR ""generative world model"")"
857631a1f277,2605.29249v1,Prediction-Powered Inference Across Many Tasks for AI Evaluation & Social Science Research,Nicolas Emmenegger; Ellery Stahler; Chara Podimata,2026-05-28,2026,arXiv,Evaluation,Medium,https://arxiv.org/abs/2605.29249v1,https://arxiv.org/pdf/2605.29249v1,,,"""uav navigation"" survey"
7be3dc3cccfa,2605.29245v1,"Implicit Identity Technologies for LLMs: Fingerprinting and Watermarking across Datasets, Models, and Generated Content",Bing Liu; Shunping Wang; Yufan Zhu; Xinyi Yu; Jing Huang; Linkang Du; Hongbin Pei; Wei Luo,2026-05-28,2026,arXiv,Evaluation,Medium,https://arxiv.org/abs/2605.29245v1,https://arxiv.org/pdf/2605.29245v1,,,"""uav navigation"" survey"
2d65e7b70a31,2605.30346v1,YoCausal: How Far is Video Generation from World Model? A Causality Perspective,You-Zhe Xie; Yu-Hsuan Li; Jie-Ying Lee; Kaipeng Zhang; Yu-Lun Liu; Zhixiang Wang,2026-05-28,2026,arXiv,Evaluation,Medium,https://arxiv.org/abs/2605.30346v1,https://arxiv.org/pdf/2605.30346v1,,,"""world model"" survey"
dde75ceac87c,2605.30263v1,minWM: A Full-Stack Open-Source Framework for Real-Time Interactive Video World Models,Min Zhao; Hongzhou Zhu; Bokai Yan; Zihan Zhou; Yimin Chen; Wenqiang Sun; Kaiwen Zheng; Guande He; Xiao Yang; Chongxuan Li; Fan Bao; Jun Zhu,2026-05-28,2026,arXiv,UAV WAM,Low,https://arxiv.org/abs/2605.30263v1,https://arxiv.org/pdf/2605.30263v1,,,"(""world action model"" OR ""action-conditioned world model"" OR ""video world model"" OR ""generative world model"")"
4c55f470b2e4,2605.29704v1,FLIP: Real-Time and Resilient Formation Planning for Large-Scale DIstributed Swarms via Point Cloud Registration,Yuan Zhou; Guangtong Xu; Zhenyu Hou; Jialiang Hou; Fei Gao,2026-05-28,2026,arXiv,Traditional UAV VLN,High,https://arxiv.org/abs/2605.29704v1,https://arxiv.org/pdf/2605.29704v1,,,"((uav OR drone OR aerial) AND (dataset OR benchmark OR simulator OR AirSim OR Flightmare OR Habitat OR ""Isaac Sim""))"
4b72cc1908a9,2605.29410v1,A Progress-Aware Leader-Follower Midair Docking System for Dual-Drone Aerial Manipulation,Yifan Cai; Jan Ming Kevin Tan; Xiangqi Li; Chenzhe Jin; Narsimlu Kemsaram; Valerio Modugno,2026-05-28,2026,arXiv,Evaluation,Medium,https://arxiv.org/abs/2605.29410v1,https://arxiv.org/pdf/2605.29410v1,,,"((uav OR drone OR aerial) AND (evaluation OR metric OR ""success rate"" OR collision OR ""OOD generalization""))"
f8cf609e1b24,2605.28237v1,POINav: Benchmarking and Enhancing Final-Meters Arrival in Real-World Vision-Language Navigation,Ruiyan Gong; Meisheng Zhang; Yuxiang Zhao; Mingchao Sun; Yanfen Shen; Zedong Chu; Zhining Gu; Wei Guo; Xiaolong Cheng; Qiming Li; Kangning Niu; Yanqing Zhu; Xiaolong Wu; Tianlun Li; Mu Xu,2026-05-27,2026,arXiv,Foundations; Evaluation,Medium,https://arxiv.org/abs/2605.28237v1,https://arxiv.org/pdf/2605.28237v1,,,"(""vision-language navigation"" AND (evaluation OR metric OR SPL OR ""success rate"" OR ""sim-to-real""))"
32f762ca510b,2605.29114v1,ReasonBreak: Probing Vulnerabilities in Reasoning-Enabled Vision-Language-Action Models for Autonomous Driving,Mohammadreza Teymoorianfard; Jean-Philippe Monteuuis; Jonathan Petit; Amir Houmansadr,2026-05-27,2026,arXiv,UAV VLA; Evaluation,Medium,https://arxiv.org/abs/2605.29114v1,https://arxiv.org/pdf/2605.29114v1,,,"(""vision-language-action"" OR ""vision language action"" OR ""openvla"" OR ""rt-2"" OR ""octo"")"
7324b19ddd79,2605.28803v1,Ω-QVLA: Robust Quantization for Vision-Language-Action Models via Composite Rotation and Per-step Scaling,Xinyu Wang; Mingze Li; Sicheng Lyu; Dongxiu Liu; Kaicheng Yang; Ziyu Zhao; Yufei Cui; Xiao-Wen Chang; Peng Lu,2026-05-27,2026,arXiv,UAV VLA,Low,https://arxiv.org/abs/2605.28803v1,https://arxiv.org/pdf/2605.28803v1,,,"(""vision-language-action"" OR ""vision language action"" OR ""openvla"" OR ""rt-2"" OR ""octo"")"
718a45fab006,2605.28486v1,Mag-VLA: Vision-Language-Action Model for Bimanual Magnetically Actuated Microrobot Manipulation,Yongchen Wang; Kangyi Lu; Lan Wei; Dandan Zhang,2026-05-27,2026,RSS,UAV VLA,Low,https://arxiv.org/abs/2605.28486v1,https://arxiv.org/pdf/2605.28486v1,,,"(""vision-language-action"" OR ""vision language action"" OR ""openvla"" OR ""rt-2"" OR ""octo"")"
39cc66145865,2605.28083v1,VLA-Hijack: A Transferable Patch Attack against Vision-Language-Action Models via Visual Proprioception Hijacking,Jiyuan Fu; Kaixun Jiang; Jingkai Jia; Zhaoyu Chen; Xueyao Chen; Lingyi Hong; Shuyong Gao; Chenzhi Tan; Dingkang Yang; Wenqiang Zhang,2026-05-27,2026,arXiv,UAV VLA,Low,https://arxiv.org/abs/2605.28083v1,https://arxiv.org/pdf/2605.28083v1,,,"(""vision-language-action"" OR ""vision language action"" OR ""openvla"" OR ""rt-2"" OR ""octo"")"
aaaa81cb8607,2605.27947v1,SANTS: A State-Adaptive Scheduler for World Action Models,Yirui Sun; Guangyu Zhuge; Keliang Liu; Jie Gu; Xinyu Bing; Zhongxue Gan; Chunxu Tian,2026-05-27,2026,arXiv,UAV WAM,Low,https://arxiv.org/abs/2605.27947v1,https://arxiv.org/pdf/2605.27947v1,,,"(""world action model"" OR ""action-conditioned world model"" OR ""video world model"" OR ""generative world model"")"
a7ffcfeadcaa,2605.28277v1,Do LLMs Build World Models From Text? A Multilingual Diagnostic of Spatial Reasoning,Zhikai Pan; Chih-Ting Liao; Chunrui Liu; Xi Xiao; Yitong Qiao; Chunlei Meng; Zhangquan Chen; Xin Cao,2026-05-27,2026,arXiv,Foundations,Medium,https://arxiv.org/abs/2605.28277v1,https://arxiv.org/pdf/2605.28277v1,,,"""world model"" survey"
59d2b54741c2,2605.28654v1,Integrated Exploration-Aware UAV Route Optimization and Path Planning,Jimin Choi; Grant Stagg; Cameron K. Peterson; Max Z. Li,2026-05-27,2026,arXiv,Traditional UAV VLN,High,https://arxiv.org/abs/2605.28654v1,https://arxiv.org/pdf/2605.28654v1,,,"((uav OR drone OR aerial) AND (""slam"" OR ""path planning"" OR ""obstacle avoidance"" OR ""semantic map""))"
c35c8c8f6bf0,2605.26503v1,Uncertainty-Aware Gaussian Map for Vision-Language Navigation,Jianzhe Gao; Rui Liu; Yuxuan Xu; Tongtong Cao; Yingxue Zhang; Zhanguang Zhang; Sida Peng; Yi Yang; Wenguan Wang,2026-05-26,2026,arXiv,Foundations,Medium,https://arxiv.org/abs/2605.26503v1,https://arxiv.org/pdf/2605.26503v1,,,"(""vision-language navigation"" AND (evaluation OR metric OR SPL OR ""success rate"" OR ""sim-to-real""))"
8141fbcb9362,2605.26500v1,3D Gaussian Map with Open-Set Semantic Grouping for Vision-Language Navigation,Jianzhe Gao; Rui Liu; Wenguan Wang,2026-05-26,2026,arXiv,Foundations,Medium,https://arxiv.org/abs/2605.26500v1,https://arxiv.org/pdf/2605.26500v1,,,"""vision-language navigation"""
00449e920e8a,2605.27759v1,Colosseum V2: Benchmarking Generalization for Vision Language Action Models,Jeremy Morgan; Prajwal Vijay; Hyeonho Oh; Jincen Song; Ashvin Arora; Alina Du; Gaurav Sukhatme; Jesse Thomason; Ishika Singh,2026-05-26,2026,arXiv,Evaluation; UAV VLA,Medium,https://arxiv.org/abs/2605.27759v1,https://arxiv.org/pdf/2605.27759v1,,,"(""vision-language-action"" OR ""vision language action"" OR ""openvla"" OR ""rt-2"" OR ""octo"")"
949be8997fb7,2605.27582v1,Uni-LaViRA: Language-Vision-Robot Actions Translation for Unified Embodied Navigation,Hongyu Ding; Sizhuo Zhang; Ziming Xu; Jinwen Guo; Hongxiu Liu; Xingzhi Cheng; Zixuan Chen; Haifei Qi; Duo Wang; Hao Xu; Jieqi Shi; Yifan Zhang; Jing Huo; Jian Cheng; Yang Gao; Jiebo Luo,2026-05-26,2026,arXiv,Foundations; UAV VLA,High,https://arxiv.org/abs/2605.27582v1,https://arxiv.org/pdf/2605.27582v1,,,"((uav OR drone OR aerial) AND (""vision-language-action"" OR ""language-conditioned policy"" OR ""action token""))"
a95831fd750d,2605.27284v1,FineVLA: Fine-Grained Instruction Alignment for Steerable Vision-Language-Action Policies,Xintong Hu; Xuhong Huang; Jinyu Zhang; Yutong Yao; Yuchong Sun; Qiuyue Wang; Mingsheng Li; Sicheng Xie; Yitao Liu; Junhao Chen; Yixuan Chen; Yingming Zheng; Shuai Bai; Tao Yu,2026-05-26,2026,arXiv,UAV VLA,Low,https://arxiv.org/abs/2605.27284v1,https://arxiv.org/pdf/2605.27284v1,,,"(""vision-language-action"" OR ""vision language action"" OR ""openvla"" OR ""rt-2"" OR ""octo"")"
9108231a248a,2605.26576v1,TrackRef3D: Multi-View Consistent Track-then-Label for Open-World Referring Segmentation in 3D Gaussian Splatting,Yuyang Tan; Renhe Zhang; Hang Zhang; Ao Li; Xin Tan,2026-05-26,2026,arXiv,Evaluation,Medium,https://arxiv.org/abs/2605.26576v1,https://arxiv.org/pdf/2605.26576v1,,,"""embodied ai"""
a698ca054144,2605.25889v3,Capability and Robustness Cannot Both Be Free: An Information-Theoretic Bound for Vision-Language-Action Models,Jianwei Tai,2026-05-25,2026,arXiv,UAV VLA,High,https://arxiv.org/abs/2605.25889v3,https://arxiv.org/pdf/2605.25889v3,,,"(""vision-language-action"" OR ""vision language action"" OR ""openvla"" OR ""rt-2"" OR ""octo"")"
431d886abaa9,2605.25829v1,OASIS: Observation-Action Space Alignment via SE(3) Trajectory Prediction for Robotic Manipulation,Xinzhe Chen; Sihua Ren; Liqi Huang; Haowen Sun; Mingyang Li; Xingyu Chen; Zeyang Liu; Xuguang Lan,2026-05-25,2026,arXiv,Evaluation,Medium,https://arxiv.org/abs/2605.25829v1,https://arxiv.org/pdf/2605.25829v1,,,"(""world action model"" OR ""action-conditioned world model"" OR ""video world model"" OR ""generative world model"")"
c920a53f7f3e,2605.25477v1,EXPO-FT: Sample-Efficient Reinforcement Learning Finetuning for Vision-Language-Action Models,Perry Dong; Kuo-Han Hung; Tian Gao; Dorsa Sadigh; Chelsea Finn,2026-05-25,2026,arXiv,UAV VLA; Evaluation,Medium,https://arxiv.org/abs/2605.25477v1,https://arxiv.org/pdf/2605.25477v1,,,"(""vision-language-action"" OR ""vision language action"" OR ""openvla"" OR ""rt-2"" OR ""octo"")"
60a6f652bebb,2605.26282v1,Scaling World-Model Reinforcement Learning Through Diffusion Policy Optimization,Xiaoyuan Cheng; Wenxuan Yuan; Zhancun Mu; Yuanzhao Zhang; Yiming Yang; Hai Wang; Zhuo Sun; Che Liu,2026-05-25,2026,arXiv,UAV VLA; UAV WAM,Low,https://arxiv.org/abs/2605.26282v1,https://arxiv.org/pdf/2605.26282v1,,,"""world model"" survey"
1199fe9933f4,2605.26200v1,Workflow Closure Is Not Scientific Closure in Auto-Research Systems,Shuai Wang; Xinyuan Tian; Pangpang Liu; Yize Zhao,2026-05-25,2026,arXiv,Datasets & Simulators,Medium,https://arxiv.org/abs/2605.26200v1,https://arxiv.org/pdf/2605.26200v1,,,"""uav navigation"" survey"
1a82d4965e2b,2605.25874v1,WBench: A Comprehensive Multi-turn Benchmark for Interactive Video World Model Evaluation,Kaining Ying; Hengrui Hu; Siyu Ren; Jiamu Li; Fengjiao Chen; Ziwen Wang; Xuezhi Cao; Xunliang Cai; Henghui Ding,2026-05-25,2026,arXiv,Evaluation; UAV WAM,Medium,https://arxiv.org/abs/2605.25874v1,https://arxiv.org/pdf/2605.25874v1,,,"(""world action model"" OR ""action-conditioned world model"" OR ""video world model"" OR ""generative world model"")"
34ba1ad5ffdd,2605.25313v1,UWM-JEPA: Predictive World Models That Imagine in Belief Space,Santosh Kumar Radha; Oktay Goktas,2026-05-25,2026,arXiv,UAV WAM,Low,https://arxiv.org/abs/2605.25313v1,https://arxiv.org/pdf/2605.25313v1,,,"""world model"" survey"
05e6c96dcb5c,2605.26330v1,NightSight: Passive Computation for Navigation in Dark Using Events,Deepak Singh; Brijan Vaghasiya; Shreyas Khobragade; Nitin Sanket,2026-05-25,2026,arXiv,Traditional UAV VLN,High,https://arxiv.org/abs/2605.26330v1,https://arxiv.org/pdf/2605.26330v1,,,"((uav OR drone OR aerial) AND (navigation OR ""visual navigation""))"
a67e42961210,2605.25706v1,Towards Open-World Referring Expression Comprehension: A Benchmark with Training-free Multi-task Consistency Checker,Zongjian Wu; Lei Zhang,2026-05-25,2026,arXiv,Evaluation,Medium,https://arxiv.org/abs/2605.25706v1,https://arxiv.org/pdf/2605.25706v1,,,"((uav OR drone OR aerial) AND (evaluation OR metric OR ""success rate"" OR collision OR ""OOD generalization""))"
437ccc9c20ad,2605.25615v1,UAV-OVO: Out-of-Viewpoint Generalization in UAV Action Recognition,Yu Xia; Zhengbo Zhang; Shuaihu Zhang; Zhigang Tu,2026-05-25,2026,arXiv,Evaluation; UAV VLA,High,https://arxiv.org/abs/2605.25615v1,https://arxiv.org/pdf/2605.25615v1,,,"((uav OR drone OR aerial) AND (dataset OR benchmark OR simulator OR AirSim OR Flightmare OR Habitat OR ""Isaac Sim""))"
94768544f97c,2605.25010v1,Performance Comparison of Classical and Neural Sampling Algorithms for Robotic Navigation,Hichem Cheriet; Badra Khellat Kihel; Samira Chouraqui,2026-05-24,2026,arXiv,Traditional UAV VLN,High,https://arxiv.org/abs/2605.25010v1,https://arxiv.org/pdf/2605.25010v1,,,"((uav OR drone OR aerial) AND (evaluation OR metric OR ""success rate"" OR collision OR ""OOD generalization""))"
7ebf79209da6,2605.25044v1,X-DiffVLA: X-Embodied Diffusion Action Heads for Vision-Language-Action Models,Boyu Li; Chaoyi Xu; Haoqi Yuan; Xinrun Xu; Börje F. Karlsson; Dongbin Zhao; Haoran Li; Zongqing Lu,2026-05-24,2026,arXiv,UAV VLA; Datasets & Simulators,Medium,https://arxiv.org/abs/2605.25044v1,https://arxiv.org/pdf/2605.25044v1,,,"(""vision-language-action"" OR ""vision language action"" OR ""openvla"" OR ""rt-2"" OR ""octo"")"
afa8dd85b9b0,2605.24892v1,X-Foresight: A Joint Vision-Action Causal Forecasting Network via Predictive World Modeling,Baolu Li; Jingyu Qian; Rui Guo; Yilun Chen; Hanpeng Liu; Yuan Lin; Junhong Zhou; Ruixin Liu; Willow Yang; Yutong Zheng; Zhenli Zhang; Tenglong; Gu; Zhuangzhuang Ding; Pengkun Zheng; Yu Zhang; Xianming Liu,2026-05-24,2026,arXiv,UAV WAM,Low,https://arxiv.org/abs/2605.24892v1,https://arxiv.org/pdf/2605.24892v1,,,"(""vision-language-action"" OR ""vision language action"" OR ""openvla"" OR ""rt-2"" OR ""octo"")"
9ac87abb04a9,2605.24890v1,QuoVLA: Quotient Space for Vision-Language-Action Models,Xuan Wang; Yinan Wu; Haoran Duan; Jungong Han,2026-05-24,2026,arXiv,UAV VLA,Low,https://arxiv.org/abs/2605.24890v1,https://arxiv.org/pdf/2605.24890v1,,,"(""vision-language-action"" OR ""vision language action"" OR ""openvla"" OR ""rt-2"" OR ""octo"")"
25552b78c5a9,2605.25073v1,"Security in the Fine-Tuning Lifecycle of Large Language Models: Threats, Defenses,Evaluation, and Future Directions",Wenjuan Li; Yitao Liu; Runze Chen; Rajkumar Buyya,2026-05-24,2026,arXiv,Evaluation,Medium,https://arxiv.org/abs/2605.25073v1,https://arxiv.org/pdf/2605.25073v1,,,"""uav navigation"" survey"
0b68e282d3c1,2605.25077v1,WorldCraft: From Camera Navigation to Object Manipulation in Interactive Video World Models,Bohai Gu; Taiyi Wu; Yueyang Yuan; Jian Liu; Xiaocheng Lu; Dazhao Du; Jie Zhang; Jinxiang Lai; Shuai Yang; Xiaotong Zhao; Alan Zhao; Song Guo,2026-05-24,2026,arXiv,UAV WAM; Evaluation,Medium,https://arxiv.org/abs/2605.25077v1,https://arxiv.org/pdf/2605.25077v1,,,"(""world action model"" OR ""action-conditioned world model"" OR ""video world model"" OR ""generative world model"")"
fb658245fed8,2605.25063v1,Reinforcement Learning for Laser Additive Manufacturing Scan-Order Optimisation: A Bilevel Proxy--FEA Diagnostic Framework for Reward and World-Model Diagnosis,Xian Wu; Haoran Li; Dongbin Zhao; Ruiyao Zhang; Yuanqi Chu; Bin Wang,2026-05-24,2026,arXiv,Evaluation,Medium,https://arxiv.org/abs/2605.25063v1,https://arxiv.org/pdf/2605.25063v1,,,"""world model"" survey"
fb75eff7be95,2605.24992v1,Scaling up Energy-Aware Multi-Agent Reinforcement Learning for Mission-Oriented Drone Networks with Individual Reward,Changling Li; Ying Li,2026-05-24,2026,arXiv,Traditional UAV VLN,High,https://arxiv.org/abs/2605.24992v1,https://arxiv.org/pdf/2605.24992v1,,,"((uav OR drone OR aerial) AND (evaluation OR metric OR ""success rate"" OR collision OR ""OOD generalization""))"
ae9e1bf93cbb,2605.24642v1,Understanding the Impact of Geometric Foundation Models on Vision-Language-Action Models,Yurou Yang; Muyuan Lin; Roberto Martin-Martin; Martin Labrie; Shreekant Gayaka; Cheng-Hao Kuo; Luca Carlone,2026-05-23,2026,arXiv,UAV VLA,Low,https://arxiv.org/abs/2605.24642v1,https://arxiv.org/pdf/2605.24642v1,,,"(""vision-language-action"" OR ""vision language action"" OR ""openvla"" OR ""rt-2"" OR ""octo"")"
764191a895c8,2605.24578v1,World Models as Group Actions,Zijie Wang; Wei Zhang; Weiming Zhang; Fanqi Zhang; Xiao Tan; Yipeng Qin; Guanbin Li,2026-05-23,2026,arXiv,UAV WAM,Low,https://arxiv.org/abs/2605.24578v1,https://arxiv.org/pdf/2605.24578v1,,,"(""world action model"" OR ""action-conditioned world model"" OR ""video world model"" OR ""generative world model"")"
710aa4750a2a,2605.24319v1,Omissive Bias in Religious Representation: Benchmarking LLM Answers to Everyday Ethical Decision-making,David Wingate; Sheryl Carty; Joshua Coates; Daniel Feldman; Nancy Fulda; Larry Howell; Brett Israelson; Dallin Jacobs; Jonathan Karr; John Paul Kimes; Elisabeth Kincaid; Paul Martens; Gavin Mobley; Suzana Pinheiro; Lindsay Slemboski; Peter Whiting,2026-05-23,2026,arXiv,Datasets & Simulators,Medium,https://arxiv.org/abs/2605.24319v1,https://arxiv.org/pdf/2605.24319v1,,,"""uav navigation"" survey"
851f571573b1,2605.24517v1,ECHO: Terminal Agents Learn World Models for Free,Vaishnavi Shrivastava; Piero Kauffmann; Ahmed Awadallah; Dimitris Papailiopoulos,2026-05-23,2026,arXiv,UAV VLA,Low,https://arxiv.org/abs/2605.24517v1,https://arxiv.org/pdf/2605.24517v1,,,"""world model"" survey"
b6ca8775fc28,2605.24354v1,SparseWorld: Enhancing End-to-End Autonomous Driving via World Models with Sparse Scene Representation,Ruoyu Wang; Jingke Wang; Yukai Ma; Yuehao Huang; Shuangming Lei; Guanglin Xu; Aixue Ye; Yong Liu,2026-05-23,2026,arXiv,Evaluation,Medium,https://arxiv.org/abs/2605.24354v1,https://arxiv.org/pdf/2605.24354v1,,,"""world model"" survey"
5a6ea68bd541,2605.24322v1,Causal Physics Steering in Video World Models via Concept Activation Vectors,Nahid Alam,2026-05-23,2026,CVPR,UAV WAM,Low,https://arxiv.org/abs/2605.24322v1,https://arxiv.org/pdf/2605.24322v1,,,"(""world action model"" OR ""action-conditioned world model"" OR ""video world model"" OR ""generative world model"")"
a68409794a15,2605.23257v1,Turning Adaptation into Assets: Cross-Domain Bridging for Online Vision-Language Navigation,Zixuan Hu; Xuantuo Huang; Yancheng Li; Yichun Hu; Shengyong Xu; Ling-Yu Duan,2026-05-22,2026,ICML,Foundations,Medium,https://arxiv.org/abs/2605.23257v1,https://arxiv.org/pdf/2605.23257v1,,,"""vision-language navigation"""
3ef7e77c0fbf,2605.24203v1,Afford-VLA: Action-Aligned Visual Planning via Internalized Affordance,Runze Wang; Yuqian Fu; Yu Li; Tao Lin; Tianwen Qian; Mohamed Elhoseiny; Bo Zhao; Yanwei Fu; Yu-Gang Jiang; Xiangyang Xue,2026-05-22,2026,arXiv,UAV VLA,Low,https://arxiv.org/abs/2605.24203v1,https://arxiv.org/pdf/2605.24203v1,,,"(""vision-language-action"" OR ""vision language action"" OR ""openvla"" OR ""rt-2"" OR ""octo"")"
f1b4956a7f8a,2605.23128v1,$π_0$-EqM: Equilibrium Matching for Closed-Loop Vision-Language-Action Control,Huanming Liu; Congsheng Xu; Jianmin Ji; Yao Mu,2026-05-22,2026,arXiv,UAV VLA,Low,https://arxiv.org/abs/2605.23128v1,https://arxiv.org/pdf/2605.23128v1,,,"(""vision-language-action"" OR ""vision language action"" OR ""openvla"" OR ""rt-2"" OR ""octo"")"
c9d50a5eabfe,2605.23856v1,Point Tracking Improves World Action Models,Jiarui Guan; Wenshuai Zhao; Yue Pei; Ziliang Chen; Arno Solin; Juho Kannala,2026-05-22,2026,arXiv,UAV WAM,Low,https://arxiv.org/abs/2605.23856v1,https://arxiv.org/pdf/2605.23856v1,,,"(""world action model"" OR ""action-conditioned world model"" OR ""video world model"" OR ""generative world model"")"
f977b092a5b3,2605.23699v1,CRONOS: Benchmarking Counterfactual Physical Consistency in Video Models,León Begiristain; Olaf Dünkel; Adam Kortylewski,2026-05-22,2026,arXiv,Datasets & Simulators,Medium,https://arxiv.org/abs/2605.23699v1,https://arxiv.org/pdf/2605.23699v1,,,"""world model"" survey"
