id,arxiv_id,title,authors,date,year,venue,topics,uav_relevance,abs_url,pdf_url,code_url,project_url,query_source
cd878f9cdf25,2508.03053v1,SkeNa: Learning to Navigate Unseen Environments Based on Abstract Hand-Drawn Maps,Haojun Xu; Jiaqi Xiang; Wu Wei; Jinyu Chen; Linqing Zhong; Linjiang Huang; Hongyu Yang; Si Liu,2025-08-05,2025,arXiv,UAV VLN; Navigation Foundation; Traditional Navigation; Embodied AI; Evaluation,High,https://arxiv.org/abs/2508.03053v1,https://arxiv.org/pdf/2508.03053v1,,,"""embodied navigation"""
646d61f46325,2508.02617v1,Vision-based Navigation of Unmanned Aerial Vehicles in Orchards: An Imitation Learning Approach,Peng Wei; Prabhash Ragbir; Stavros G. Vougioukas; Zhaodan Kong,2025-08-04,2025,arXiv,Traditional Navigation; Multimodal Perception,Medium,https://arxiv.org/abs/2508.02617v1,https://arxiv.org/pdf/2508.02617v1,,,"""uav navigation"""
98bee8911d5c,2508.02549v4,MonoDream: Monocular Vision-Language Navigation with Panoramic Dreaming,Shuo Wang; Yongcai Wang; Zhaoxin Fan; Yucheng Wang; Maiyue Chen; Kaihui Wang; Zhizhong Su; Wanting Li; Xudong Cai; Yeying Jin; Deying Li,2025-08-04,2025,arXiv,UAV VLN; Navigation Foundation; Vision-Language-Action,High,https://arxiv.org/abs/2508.02549v4,https://arxiv.org/pdf/2508.02549v4,,,"""vision language navigation"""
8b55872b9368,2508.02046v4,NaviMaster: Learning a Unified Policy for GUI and Embodied Navigation Tasks,Zhihao Luo; Wentao Yan; Jingyu Gong; Min Wang; Zhizhong Zhang; Xuhong Wang; Yuan Xie; Xin Tan,2025-08-04,2025,arXiv,UAV VLN; Navigation Foundation; Embodied AI; Evaluation,High,https://arxiv.org/abs/2508.02046v4,https://arxiv.org/pdf/2508.02046v4,,,"""embodied navigation"""
c1fd9131d1f7,2508.01936v1,CVD-SfM: A Cross-View Deep Front-end Structure-from-Motion System for Sparse Localization in Multi-Altitude Scenes,Yaxuan Li; Yewei Huang; Bijay Gaudel; Hamidreza Jafarnejadsani; Brendan Englot,2025-08-03,2025,arXiv,UAV VLN,High,https://arxiv.org/abs/2508.01936v1,https://arxiv.org/pdf/2508.01936v1,,,"""aerial navigation"""
27912599fa49,2508.01766v6,VPN: Visual Prompt Navigation,Shuo Feng; Zihan Wang; Yuchen Li; Rui Kong; Hengyi Cai; Shuaiqiang Wang; Gim Hee Lee; Piji Li; Shuqiang Jiang,2025-08-03,2025,arXiv,UAV VLN; Navigation Foundation; Traditional Navigation; Embodied AI,High,https://arxiv.org/abs/2508.01766v6,https://arxiv.org/pdf/2508.01766v6,,,"""language-guided navigation"""
d6fadb49a68c,2508.01922v1,Beyond Simulation: Benchmarking World Models for Planning and Causality in Autonomous Driving,Hunter Schofield; Mohammed Elmahgiubi; Kasra Rezaee; Jinjun Shan,2025-08-03,2025,ICRA,World Action Model; Multimodal Perception,Low,https://arxiv.org/abs/2508.01922v1,https://arxiv.org/pdf/2508.01922v1,,,"""action-conditioned world model"""
8b05423a0b01,2508.01723v1,OpenMap: Instruction Grounding via Open-Vocabulary Visual-Language Mapping,Danyang Li; Zenghui Yang; Guangpeng Qi; Songtao Pang; Guangyong Shang; Qiang Ma; Zheng Yang,2025-08-03,2025,arXiv,UAV VLN; Navigation Foundation; Instruction Following; Embodied AI; Multimodal Perception,High,https://arxiv.org/abs/2508.01723v1,https://arxiv.org/pdf/2508.01723v1,,,"""embodied navigation"""
9c624267c217,2508.00288v4,UAV-ON: A Benchmark for Open-World Object Goal Navigation with Aerial Agents,Jianqiang Xiao; Yuexuan Sun; Yixin Shao; Boxi Gan; Rongqiang Liu; Yanjing Wu; Weili Guan; Xiang Deng,2025-08-01,2025,arXiv,UAV VLN; Traditional Navigation; Embodied AI; Dataset / Simulator,High,https://arxiv.org/abs/2508.00288v4,https://arxiv.org/pdf/2508.00288v4,,,"""aerial navigation"""
38a6e3a0a036,2508.00390v1,SA-GCS: Semantic-Aware Gaussian Curriculum Scheduling for UAV Vision-Language Navigation,Hengxing Cai; Jinhan Dong; Yijie Rao; Jingcheng Deng; Jingjun Tan; Qien Chen; Haidong Wang; Zhen Wang; Shiyu Huang; Agachai Sumalee; Renxin Zhong,2025-08-01,2025,arXiv,UAV VLN; Navigation Foundation; Instruction Following; Evaluation,High,https://arxiv.org/abs/2508.00390v1,https://arxiv.org/pdf/2508.00390v1,,,"""uav vision-language navigation"""
89cbf690837b,2507.21450v1,Recursive Visual Imagination and Adaptive Linguistic Grounding for Vision Language Navigation,Bolei Chen; Jiaxu Kang; Yifei Wang; Ping Zhong; Qi Wu; Jianxin Wang,2025-07-29,2025,arXiv,UAV VLN; Navigation Foundation; Multimodal Perception,High,https://arxiv.org/abs/2507.21450v1,https://arxiv.org/pdf/2507.21450v1,,,"""vision language navigation"""
69a3245780f5,2507.19468v1,Back to the Features: DINO as a Foundation for Video World Models,Federico Baldassarre; Marc Szafraniec; Basile Terver; Vasil Khalidov; Francisco Massa; Yann LeCun; Patrick Labatut; Maximilian Seitzer; Piotr Bojanowski,2025-07-25,2025,arXiv,World Action Model; Multimodal Perception,Low,https://arxiv.org/abs/2507.19468v1,https://arxiv.org/pdf/2507.19468v1,,,"""video prediction"""
eef9f13afb48,2507.18160v1,Autonomous UAV Navigation for Search and Rescue Missions Using Computer Vision and Convolutional Neural Networks,Luka Šiktar; Branimir Ćaran; Bojan Šekoranja; Marko Švaco,2025-07-24,2025,arXiv,UAV VLN; Traditional Navigation; Multimodal Perception,High,https://arxiv.org/abs/2507.18160v1,https://arxiv.org/pdf/2507.18160v1,,,"""uav navigation"""
e5bfa89dca9c,2507.18033v1,OpenNav: Open-World Navigation with Multimodal Large Language Models,Mingfeng Yuan; Letian Wang; Steven L. Waslander,2025-07-24,2025,IROS,UAV VLN; Navigation Foundation; Multimodal Perception,High,https://arxiv.org/abs/2507.18033v1,https://arxiv.org/pdf/2507.18033v1,,,"""vision language navigation"""
8608d1a5394f,2507.16038v1,Discovering and using Spelke segments,Rahul Venkatesh; Klemen Kotar; Lilian Naing Chen; Seungwoo Kim; Luca Thomas Wheeler; Jared Watrous; Ashley Xu; Gia Ancone; Wanhee Lee; Honglin Chen; Daniel Bear; Stefan Stojanov; Daniel Yamins,2025-07-21,2025,arXiv,World Action Model; Evaluation,Low,https://arxiv.org/abs/2507.16038v1,https://arxiv.org/pdf/2507.16038v1,,,"""visual world model"""
0c5a2193971e,2507.15089v1,Visual Place Recognition for Large-Scale UAV Applications,Ioannis Tsampikos Papapetros; Ioannis Kansizoglou; Antonios Gasteratos,2025-07-20,2025,arXiv,Dataset / Simulator; Evaluation,Medium,https://arxiv.org/abs/2507.15089v1,https://arxiv.org/pdf/2507.15089v1,,,"""uav navigation"""
d85b5146f5d7,2507.14809v2,Light Future: Multimodal Action Frame Prediction via InstructPix2Pix,Zesen Zhong; Duomin Zhang; Yijia Li,2025-07-20,2025,arXiv,Vision-Language-Action; World Action Model,Low,https://arxiv.org/abs/2507.14809v2,https://arxiv.org/pdf/2507.14809v2,,,"""video prediction"""
65e621225f23,2507.14731v2,X-Nav: Learning End-to-End Cross-Embodiment Navigation for Mobile Robots,Haitong Wang; Aaron Hao Tan; Angus Fung; Goldie Nejat,2025-07-19,2025,arXiv,Multimodal Perception; Evaluation,Low,https://arxiv.org/abs/2507.14731v2,https://arxiv.org/pdf/2507.14731v2,,,"""embodied navigation"""
4c4b64b45099,2507.13152v3,SE-VLN: A Self-Evolving Vision-Language Navigation Framework Based on Multimodal Large Language Models,Xiangyu Dong; Haoran Zhao; Jiang Gao; Haozhou Li; Xiaoguang Ma; Yaoming Zhou; Fuhai Chen; Juan Liu,2025-07-17,2025,arXiv,UAV VLN; Navigation Foundation; Evaluation,High,https://arxiv.org/abs/2507.13152v3,https://arxiv.org/pdf/2507.13152v3,,,"""vision language navigation"""
8461ba554ba7,2507.11992v4,Understanding visual attention beehind bee-inspired UAV navigation,Pranav Rajbhandari; Abhi Veda; Matthew Garratt; Mandyam Srinivasan; Sridhar Ravi,2025-07-16,2025,arXiv,UAV VLN; Traditional Navigation; Multimodal Perception,High,https://arxiv.org/abs/2507.11992v4,https://arxiv.org/pdf/2507.11992v4,,,"""uav navigation"""
608cf10499f7,2507.11173v1,Real-Time Bayesian Detection of Drift-Evasive GNSS Spoofing in Reinforcement Learning Based UAV Deconfliction,Deepak Kumar Panda; Weisi Guo,2025-07-15,2025,arXiv,UAV VLN; Multimodal Perception,High,https://arxiv.org/abs/2507.11173v1,https://arxiv.org/pdf/2507.11173v1,,,"""uav navigation"""
e541d6c357e5,2507.10894v1,NavComposer: Composing Language Instructions for Navigation Trajectories through Action-Scene-Object Modularization,Zongtao He; Liuyi Wang; Lu Chen; Chengju Liu; Qijun Chen,2025-07-15,2025,arXiv,UAV VLN; Instruction Following; Embodied AI,High,https://arxiv.org/abs/2507.10894v1,https://arxiv.org/pdf/2507.10894v1,,,"""language-guided navigation"""
248675f0595d,2507.11296v1,Diffusion-Based Imaginative Coordination for Bimanual Manipulation,Huilin Xu; Jian Ding; Jiakun Xu; Ruixiang Wang; Jun Chen; Jinjie Mai; Yanwei Fu; Bernard Ghanem; Feng Xu; Mohamed Elhoseiny,2025-07-15,2025,ICCV,Vision-Language-Action; World Action Model; Multimodal Perception; Evaluation,Low,https://arxiv.org/abs/2507.11296v1,https://arxiv.org/pdf/2507.11296v1,,,"""video prediction"""
b816aec589bf,2507.09344v1,C-ZUPT: Stationarity-Aided Aerial Hovering,Daniel Engelsman; Itzik Klein,2025-07-12,2025,arXiv,UAV VLN,High,https://arxiv.org/abs/2507.09344v1,https://arxiv.org/pdf/2507.09344v1,,,"""aerial navigation"""
4be0284d8bb8,2507.08885v2,AirScape: An Aerial Generative World Model with Motion Controllability,Baining Zhao; Rongze Tang; Mingyuan Jia; Ziyou Wang; Fanghang Man; Xin Zhang; Yu Shang; Weichen Zhang; Wei Wu; Chen Gao; Xinlei Chen; Yong Li,2025-07-10,2025,arXiv,World Action Model; Embodied AI,High,https://arxiv.org/abs/2507.08885v2,https://arxiv.org/pdf/2507.08885v2,,,"""generative world model"""
278fb669da78,2507.07982v2,Geometry Forcing: Marrying Video Diffusion and 3D Representation for Consistent World Modeling,Haoyu Wu; Diankun Wu; Tianyu He; Junliang Guo; Yang Ye; Yueqi Duan; Jiang Bian,2025-07-10,2025,arXiv,World Action Model,Low,https://arxiv.org/abs/2507.07982v2,https://arxiv.org/pdf/2507.07982v2,,,"""action-conditioned video generation"""
9166c74f107c,2507.06738v1,DIFFUMA: High-Fidelity Spatio-Temporal Video Prediction via Dual-Path Mamba and Diffusion Enhancement,Xinyu Xie; Weifeng Cao; Jun Shi; Yangyang Hu; Hui Liang; Wanyong Liang; Xiaoliang Qian,2025-07-09,2025,arXiv,World Action Model; Multimodal Perception; Dataset / Simulator,Medium,https://arxiv.org/abs/2507.06738v1,https://arxiv.org/pdf/2507.06738v1,,,"""video prediction"""
ae44929b7178,2507.04047v2,Move to Understand a 3D Scene: Bridging Visual Grounding and Exploration for Efficient and Versatile Embodied Navigation,Ziyu Zhu; Xilin Wang; Yixuan Li; Zhuofan Zhang; Xiaojian Ma; Yixin Chen; Baoxiong Jia; Wei Liang; Qian Yu; Zhidong Deng; Siyuan Huang; Qing Li,2025-07-05,2025,ICCV,UAV VLN; Navigation Foundation; Traditional Navigation; Embodied AI; Multimodal Perception; Evaluation,High,https://arxiv.org/abs/2507.04047v2,https://arxiv.org/pdf/2507.04047v2,,,"""embodied navigation"""
3bc3efd2740a,2506.24113v1,Epona: Autoregressive Diffusion World Model for Autonomous Driving,Kaiwen Zhang; Zhenyu Tang; Xiaotao Hu; Xingang Pan; Xiaoyang Guo; Yuan Liu; Jingwei Huang; Li Yuan; Qian Zhang; Xiao-Xiao Long; Xun Cao; Wei Yin,2025-06-30,2025,ICCV,Traditional Navigation; World Action Model,Medium,https://arxiv.org/abs/2506.24113v1,https://arxiv.org/pdf/2506.24113v1,,,"""video prediction"""
5e4bf953746c,2506.21976v1,SceneDiffuser++: City-Scale Traffic Simulation via a Generative World Model,Shuhan Tan; John Lambert; Hong Jeon; Sakshum Kulshrestha; Yijing Bai; Jing Luo; Dragomir Anguelov; Mingxing Tan; Chiyu Max Jiang,2025-06-27,2025,CVPR,World Action Model; Multimodal Perception; Dataset / Simulator,Medium,https://arxiv.org/abs/2506.21976v1,https://arxiv.org/pdf/2506.21976v1,,,"""generative world model"""
03cb49217549,2506.21129v1,Curriculum-Guided Antifragile Reinforcement Learning for Secure UAV Deconfliction under Observation-Space Attacks,Deepak Kumar Panda; Adolfo Perrusquia; Weisi Guo,2025-06-26,2025,arXiv,Multimodal Perception,Medium,https://arxiv.org/abs/2506.21129v1,https://arxiv.org/pdf/2506.21129v1,,,"""uav navigation"""
d696d9921cf7,2506.21127v3,Meta Policy Switching for Secure UAV Deconfliction in Adversarial Airspace,Deepak Kumar Panda; Weisi Guo,2025-06-26,2025,arXiv,UAV VLN; Traditional Navigation; Multimodal Perception,High,https://arxiv.org/abs/2506.21127v3,https://arxiv.org/pdf/2506.21127v3,,,"""uav navigation"""
16a9901db89b,2506.21552v1,Whole-Body Conditioned Egocentric Video Prediction,Yutong Bai; Danny Tran; Amir Bar; Yann LeCun; Trevor Darrell; Jitendra Malik,2025-06-26,2025,arXiv,World Action Model; Embodied AI; Multimodal Perception,Medium,https://arxiv.org/abs/2506.21552v1,https://arxiv.org/pdf/2506.21552v1,,,"""video prediction"""
0b201669ef9c,2506.20134v1,From 2D to 3D Cognition: A Brief Survey of General World Models,Ningwei Xie; Zizi Tian; Lei Yang; Xiao-Ping Zhang; Meng Guo; Jie Li,2025-06-25,2025,arXiv,Navigation Foundation; World Action Model; Embodied AI; Multimodal Perception; Survey,Medium,https://arxiv.org/abs/2506.20134v1,https://arxiv.org/pdf/2506.20134v1,,,"""generative world model"""
45597e20646c,2506.18897v2,MinD: Learning A Dual-System World Model for Real-Time Planning and Implicit Risk Analysis,Xiaowei Chi; Kuangzhi Ge; Jiaming Liu; Siyuan Zhou; Peidong Jia; Zichen He; Yuzhen Liu; Tingguang Li; Lei Han; Sirui Han; Shanghang Zhang; Yike Guo,2025-06-23,2025,arXiv,Vision-Language-Action; World Action Model; Evaluation,Low,https://arxiv.org/abs/2506.18897v2,https://arxiv.org/pdf/2506.18897v2,,,"""generative world model"""
908710925366,2506.17221v2,VLN-R1: Vision-Language Navigation via Reinforcement Fine-Tuning,Zhangyang Qi; Zhixiong Zhang; Yizhou Yu; Jiaqi Wang; Hengshuang Zhao,2025-06-20,2025,arXiv,UAV VLN; Navigation Foundation; Traditional Navigation; Instruction Following; Embodied AI; Multimodal Perception; Dataset / Simulator,High,https://arxiv.org/abs/2506.17221v2,https://arxiv.org/pdf/2506.17221v2,,,"""embodied navigation"""
a5ee9b300459,2506.16652v1,CodeDiffuser: Attention-Enhanced Diffusion Policy via VLM-Generated Code for Instruction Ambiguity,Guang Yin; Yitong Li; Yixuan Wang; Dale McConachie; Paarth Shah; Kunimatsu Hashimoto; Huan Zhang; Katherine Liu; Yunzhu Li,2025-06-19,2025,RSS,Instruction Following; Vision-Language-Action,Low,https://arxiv.org/abs/2506.16652v1,https://arxiv.org/pdf/2506.16652v1,,,"""language-conditioned policy"""
4ff6707b9bda,2506.14198v1,AMPLIFY: Actionless Motion Priors for Robot Learning from Videos,Jeremy A. Collins; Loránd Cheng; Kunal Aneja; Albert Wilcox; Benjamin Joffe; Animesh Garg,2025-06-17,2025,arXiv,Vision-Language-Action; World Action Model; Evaluation,Low,https://arxiv.org/abs/2506.14198v1,https://arxiv.org/pdf/2506.14198v1,,,"""video prediction"""
1ece2e4b59da,2506.14009v2,GRaD-Nav++: Vision-Language Model Enabled Visual Drone Navigation with Gaussian Radiance Fields and Differentiable Dynamics,Qianzhong Chen; Naixiang Gao; Suning Huang; JunEn Low; Timothy Chen; Jiankai Sun; Mac Schwager,2025-06-16,2025,arXiv,UAV VLN; Vision-Language-Action; Multimodal Perception; Evaluation,High,https://arxiv.org/abs/2506.14009v2,https://arxiv.org/pdf/2506.14009v2,,,"""language-guided navigation"""
093d98ecc642,2506.13751v3,LeVERB: Humanoid Whole-Body Control with Latent Vision-Language Instruction,Haoru Xue; Xiaoyu Huang; Dantong Niu; Qiayuan Liao; Thomas Kragerud; Jan Tommy Gravdahl; Xue Bin Peng; Guanya Shi; Trevor Darrell; Koushil Sreenath; Shankar Sastry,2025-06-16,2025,arXiv,Navigation Foundation; Traditional Navigation; Vision-Language-Action; Multimodal Perception; Dataset / Simulator; Evaluation,Medium,https://arxiv.org/abs/2506.13751v3,https://arxiv.org/pdf/2506.13751v3,,,"""vision-language policy"""
b7882d61c9c8,2506.13138v3,STAGE: A Stream-Centric Generative World Model for Long-Horizon Driving-Scene Simulation,Jiamin Wang; Yichen Yao; Xiang Feng; Hang Wu; Yaming Wang; Qingqiu Huang; Yuexin Ma; Xinge Zhu,2025-06-16,2025,IROS,World Action Model; Multimodal Perception,Low,https://arxiv.org/abs/2506.13138v3,https://arxiv.org/pdf/2506.13138v3,,,"""generative world model"""
aeb3b865fe5c,2506.11302v3,TARDIS STRIDE: A Spatio-Temporal Road Image Dataset and World Model for Autonomy,Héctor Carrión; Yutong Bai; Víctor A. Hernández Castro; Kishan Panaganti; Ayush Zenith; Matthew Trang; Tony Zhang; Pietro Perona; Jitendra Malik,2025-06-12,2025,arXiv,Navigation Foundation; Traditional Navigation; Vision-Language-Action; World Action Model; Multimodal Perception,Medium,https://arxiv.org/abs/2506.11302v3,https://arxiv.org/pdf/2506.11302v3,,,"""generative world model"""
2723aad601d5,2506.09985v1,"V-JEPA 2: Self-Supervised Video Models Enable Understanding, Prediction and Planning",Mido Assran; Adrien Bardes; David Fan; Quentin Garrido; Russell Howes; Mojtaba; Komeili; Matthew Muckley; Ammar Rizvi; Claire Roberts; Koustuv Sinha; Artem Zholus; Sergio Arnaud; Abha Gejji; Ada Martin; Francois Robert Hogan; Daniel Dugas; Piotr Bojanowski; Vasil Khalidov; Patrick Labatut; Francisco Massa; Marc Szafraniec; Kapil Krishnakumar; Yong Li; Xiaodong Ma; Sarath Chandar; Franziska Meier; Yann LeCun; Michael Rabbat; Nicolas Ballas,2025-06-11,2025,arXiv,World Action Model; Multimodal Perception,Low,https://arxiv.org/abs/2506.09985v1,https://arxiv.org/pdf/2506.09985v1,,,"""action-conditioned world model"""
0049e92ec3ea,2506.09839v1,OctoNav: Towards Generalist Embodied Navigation,Chen Gao; Liankai Jin; Xingyu Peng; Jiazhao Zhang; Yue Deng; Annan Li; He Wang; Si Liu,2025-06-11,2025,arXiv,UAV VLN; Navigation Foundation; Vision-Language-Action; Embodied AI; Multimodal Perception,High,https://arxiv.org/abs/2506.09839v1,https://arxiv.org/pdf/2506.09839v1,,,"""embodied navigation"""
a3f89627ee92,2506.05543v1,FRAME: Pre-Training Video Feature Representations via Anticipation and Memory,Sethuraman TV; Savya Khosla; Vignesh Srinivasakumar; Jiahui Huang; Seoung Wug Oh; Simon Jenni; Derek Hoiem; Joon-Young Lee,2025-06-05,2025,arXiv,World Action Model,Low,https://arxiv.org/abs/2506.05543v1,https://arxiv.org/pdf/2506.05543v1,,,"""video prediction"""
ae0f53ec5d71,2506.02649v2,From Prompts to Protection: Large Language Model-Enabled In-Context Learning for Smart Public Safety UAV,Yousef Emami; Hao Zhou; Miguel Gutierrez Gaitan; Kai Li; Luis Almeida; Zhu Han,2025-06-03,2025,arXiv,UAV VLN; Traditional Navigation; Multimodal Perception; Evaluation,High,https://arxiv.org/abs/2506.02649v2,https://arxiv.org/pdf/2506.02649v2,,,"""uav navigation"""
8e4dd66e5030,2506.03297v1,Dynamics and Control of Vision-Aided Multi-UAV-tethered Netted System Capturing Non-Cooperative Target,Runhan Liu; Hui Ren; Wei Fan,2025-06-03,2025,arXiv,World Action Model; Multimodal Perception,High,https://arxiv.org/abs/2506.03297v1,https://arxiv.org/pdf/2506.03297v1,,,"""uav simulator"""
6dd053210956,2506.01950v4,DualMap: Online Open-Vocabulary Semantic Mapping for Natural Language Navigation in Dynamic Changing Scenes,Jiajun Jiang; Yiming Zhu; Zirui Wu; Jie Song,2025-06-02,2025,arXiv,UAV VLN; Multimodal Perception,High,https://arxiv.org/abs/2506.01950v4,https://arxiv.org/pdf/2506.01950v4,,,"""language-guided navigation"""
b4cdaf2e9811,2506.01392v2,Sparse Imagination for Efficient Visual World Model Planning,Junha Chun; Youngjoon Jeong; Taesup Kim,2025-06-02,2025,ICLR,Vision-Language-Action; World Action Model; Multimodal Perception,Low,https://arxiv.org/abs/2506.01392v2,https://arxiv.org/pdf/2506.01392v2,,,"""visual world model"""
b937055d625d,2506.01299v3,Scalable In-Context Q-Learning,Jinmei Liu; Fuhong Liu; Zhenhong Sun; Jianye Hao; Huaxiong Li; Bo Wang; Daoyi Dong; Chunlin Chen; Zhi Wang,2025-06-02,2025,ICLR,Traditional Navigation; Multimodal Perception; Evaluation,Medium,https://arxiv.org/abs/2506.01299v3,https://arxiv.org/pdf/2506.01299v3,,,"""generative world model"""
2198422c38e2,2506.01380v2,Playing with Transformer at 30+ FPS via Next-Frame Diffusion,Xinle Cheng; Tianyu He; Jiayi Xu; Junliang Guo; Di He; Jiang Bian,2025-06-02,2025,arXiv,World Action Model,Low,https://arxiv.org/abs/2506.01380v2,https://arxiv.org/pdf/2506.01380v2,,,"""action-conditioned video generation"""
d24b84631eeb,2506.01031v1,NavBench: Probing Multimodal Large Language Models for Embodied Navigation,Yanyuan Qiao; Haodong Hong; Wenqi Lyu; Dong An; Siqi Zhang; Yutong Xie; Xinyu Wang; Qi Wu,2025-06-01,2025,arXiv,UAV VLN; Navigation Foundation; Embodied AI; Evaluation,High,https://arxiv.org/abs/2506.01031v1,https://arxiv.org/pdf/2506.01031v1,,,"""embodied navigation"""
62c87a73f6d0,2506.00613v3,WorldGym: World Model as An Environment for Policy Evaluation,Julian Quevedo; Ansh Kumar Sharma; Yixiang Sun; Varad Suryavanshi; Percy Liang; Sherry Yang,2025-05-31,2025,arXiv,Vision-Language-Action; World Action Model; Multimodal Perception; Evaluation,Low,https://arxiv.org/abs/2506.00613v3,https://arxiv.org/pdf/2506.00613v3,,,"""action-conditioned video generation"""
a4be8e707766,2505.24156v1,Towards a Generalizable Bimanual Foundation Policy via Flow-based Video Prediction,Chenyou Fan; Fangzheng Yan; Chenjia Bai; Jiepeng Wang; Chi Zhang; Zhen Wang; Xuelong Li,2025-05-30,2025,arXiv,Vision-Language-Action; World Action Model; Embodied AI; Multimodal Perception,Medium,https://arxiv.org/abs/2505.24156v1,https://arxiv.org/pdf/2505.24156v1,,,"""video prediction"""
309994cad598,2505.23267v1,VLM-RRT: Vision Language Model Guided RRT Search for Autonomous UAV Navigation,Jianlin Ye; Savvas Papaioannou; Panayiotis Kolios,2025-05-29,2025,arXiv,UAV VLN; Traditional Navigation,High,https://arxiv.org/abs/2505.23267v1,https://arxiv.org/pdf/2505.23267v1,,,"""uav navigation"""
7d5efd7e010c,2506.03173v2,FOLIAGE: Towards Physical Intelligence World Models Via Unbounded Surface Evolution,Xiaoyi Liu; Hao Tang,2025-05-29,2025,arXiv,World Action Model; Multimodal Perception,Low,https://arxiv.org/abs/2506.03173v2,https://arxiv.org/pdf/2506.03173v2,,,"""generative world model"""
41b8693c74ef,2505.22111v2,Autoregression-free video prediction using diffusion model for mitigating error propagation,Woonho Ko; Jin Bok Park; Il Yong Chun,2025-05-28,2025,arXiv,World Action Model,Low,https://arxiv.org/abs/2505.22111v2,https://arxiv.org/pdf/2505.22111v2,,,"""video prediction"""
13c7748800f2,2505.20783v1,FM-Planner: Foundation Model Guided Path Planning for Autonomous Drone Navigation,Jiaping Xiao; Cheng Wen Tsao; Yuhang Zhang; Mir Feroskhan,2025-05-27,2025,arXiv,UAV VLN; Traditional Navigation; Multimodal Perception,High,https://arxiv.org/abs/2505.20783v1,https://arxiv.org/pdf/2505.20783v1,,,"""drone navigation"""
7df2a872fd7c,2505.21652v3,PartInstruct: Part-level Instruction Following for Fine-grained Robot Manipulation,Yifan Yin; Zhengtao Han; Shivam Aarya; Jianxin Wang; Shuhang Xu; Jiawei Peng; Angtian Wang; Alan Yuille; Tianmin Shu,2025-05-27,2025,arXiv,Navigation Foundation; Vision-Language-Action; Multimodal Perception; Evaluation,Medium,https://arxiv.org/abs/2505.21652v3,https://arxiv.org/pdf/2505.21652v3,,,"""vision-language policy"""
432479ac19c3,2505.16474v2,Foresight Diffusion: Improving Sampling Consistency in Predictive Diffusion Models,Yu Zhang; Xingzhuo Guo; Haoran Xu; Jialong Wu; Mingsheng Long,2025-05-22,2025,ICLR,World Action Model,Low,https://arxiv.org/abs/2505.16474v2,https://arxiv.org/pdf/2505.16474v2,,,"""video prediction"""
94a2605a9df9,2505.16663v1,CoNav: Collaborative Cross-Modal Reasoning for Embodied Navigation,Haihong Hao; Mingfei Han; Changlin Li; Zhihui Li; Xiaojun Chang,2025-05-22,2025,arXiv,UAV VLN; Navigation Foundation; Embodied AI; Multimodal Perception; Evaluation,High,https://arxiv.org/abs/2505.16663v1,https://arxiv.org/pdf/2505.16663v1,,,"""embodied navigation"""
f1ebff525185,2505.14948v1,Programmatic Video Prediction Using Large Language Models,Hao Tang; Kevin Ellis; Suhas Lohit; Michael J. Jones; Moitreya Chatterjee,2025-05-20,2025,arXiv,World Action Model,Low,https://arxiv.org/abs/2505.14948v1,https://arxiv.org/pdf/2505.14948v1,,,"""video prediction"""
2a59dc73d7ad,2505.12428v1,Depth Transfer: Learning to See Like a Simulator for Real-World Drone Navigation,Hang Yu; Christophe De Wagter; Guido C. H. E de Croon,2025-05-18,2025,arXiv,UAV VLN; Traditional Navigation; Multimodal Perception; Dataset / Simulator; Evaluation,High,https://arxiv.org/abs/2505.12428v1,https://arxiv.org/pdf/2505.12428v1,,,"""drone navigation"""
0b44520d0b92,2505.12489v2,Video-GPT via Next Clip Diffusion,Shaobin Zhuang; Zhipeng Huang; Ying Zhang; Fangyikang Wang; Canmiao Fu; Binxin Yang; Chong Sun; Chen Li; Yali Wang,2025-05-18,2025,arXiv,World Action Model; Multimodal Perception; Evaluation,Low,https://arxiv.org/abs/2505.12489v2,https://arxiv.org/pdf/2505.12489v2,,,"""video prediction"""
9c6f68c49665,2505.10911v2,ReWiND: Language-Guided Rewards Teach Robot Policies without New Demonstrations,Jiahui Zhang; Yusen Luo; Abrar Anwar; Sumedh Anand Sontakke; Joseph J Lim; Jesse Thomason; Erdem Biyik; Jesse Zhang,2025-05-16,2025,CoRL,Vision-Language-Action; Multimodal Perception; Evaluation,Low,https://arxiv.org/abs/2505.10911v2,https://arxiv.org/pdf/2505.10911v2,,,"""language-conditioned policy"""
574d2d404a87,2505.10359v1,NVSPolicy: Adaptive Novel-View Synthesis for Generalizable Language-Conditioned Policy Learning,Le Shi; Yifei Shi; Xin Xu; Tenglong Liu; Junhua Xi; Chengyuan Chen,2025-05-15,2025,arXiv,Vision-Language-Action; Evaluation,Low,https://arxiv.org/abs/2505.10359v1,https://arxiv.org/pdf/2505.10359v1,,,"""language-conditioned policy"""
15b8a0d71e47,2505.10010v1,ImagineBench: Evaluating Reinforcement Learning with Large Language Model Rollouts,Jing-Cheng Pang; Kaiyuan Li; Yidi Wang; Si-Hang Yang; Shengyi Jiang; Yang Yu,2025-05-15,2025,arXiv,Vision-Language-Action; Evaluation,Low,https://arxiv.org/abs/2505.10010v1,https://arxiv.org/pdf/2505.10010v1,,,"""language-conditioned policy"""
cdb9cd5afe0b,2505.10075v1,FlowDreamer: A RGB-D World Model with Flow-based Motion Representations for Robot Manipulation,Jun Guo; Xiaojian Ma; Yikai Wang; Min Yang; Huaping Liu; Qing Li,2025-05-15,2025,arXiv,World Action Model; Evaluation,Low,https://arxiv.org/abs/2505.10075v1,https://arxiv.org/pdf/2505.10075v1,,,"""video prediction"""
