id,arxiv_id,title,authors,date,year,venue,topics,uav_relevance,abs_url,pdf_url,code_url,project_url,query_source
7d0149b5ae12,2603.15771v1,CorrectionPlanner: Self-Correction Planner with Reinforcement Learning in Autonomous Driving,Yihong Guo; Dongqiangzi Ye; Sijia Chen; Anqi Liu; Xianming Liu,2026-03-16,2026,arXiv,World Action Model; Multimodal Perception; Evaluation,Low,https://arxiv.org/abs/2603.15771v1,https://arxiv.org/pdf/2603.15771v1,,,"""model-based reinforcement learning"""
a23dff9a59b7,2603.16016v1,FlatLands: Generative Floormap Completion From a Single Egocentric View,Subhransu S. Bhattacharjee; Dylan Campbell; Rahul Shome,2026-03-16,2026,arXiv,UAV VLN; Navigation Foundation; Embodied AI,High,https://arxiv.org/abs/2603.16016v1,https://arxiv.org/pdf/2603.16016v1,,,"""embodied navigation"""
2f0c99888eca,2603.14363v1,AerialVLA: A Vision-Language-Action Model for UAV Navigation via Minimalist End-to-End Control,Peng Xu; Zhengnan Deng; Jiayan Deng; Zonghua Gu; Shaohua Wan,2026-03-15,2026,arXiv,UAV VLN; Navigation Foundation; Vision-Language-Action; Multimodal Perception; Dataset / Simulator; Evaluation,High,https://arxiv.org/abs/2603.14363v1,https://arxiv.org/pdf/2603.14363v1,,,"""vision language navigation"""
f6e0afad69f0,2603.13833v1,ImagiNav: Scalable Embodied Navigation via Generative Visual Prediction and Inverse Dynamics,Jie Chen; Yuxin Cai; Yizhuo Wang; Ruofei Bai; Yuhong Cao; Jun Li; Yau Wei Yun; Guillaume Sartoretti,2026-03-14,2026,arXiv,UAV VLN; Navigation Foundation; World Action Model; Embodied AI; Multimodal Perception,High,https://arxiv.org/abs/2603.13833v1,https://arxiv.org/pdf/2603.13833v1,,,"""embodied navigation"""
d1b7ea877e21,2603.14039v1,EyeWorld: A Generative World Model of Ocular State and Dynamics,Ziyu Gao; Xinyuan Wu; Xiaolan Chen; Zhuoran Liu; Ruoyu Chen; Bowen Liu; Bingjie Yan; Zhenhan Wang; Kai Jin; Jiancheng Yang; Yih Chung Tham; Mingguang He; Danli Shi,2026-03-14,2026,arXiv,World Action Model; Multimodal Perception,Low,https://arxiv.org/abs/2603.14039v1,https://arxiv.org/pdf/2603.14039v1,,,"""generative world model"""
715ae18da435,2603.12696v2,HaltNav: Reactive Visual Halting over Lightweight Topological Priors for Robust Vision-Language Navigation,Zihui Yu; Pingcong Li; Bichi Zhang; Sören Schwertfeger,2026-03-13,2026,arXiv,UAV VLN; Navigation Foundation; Traditional Navigation,High,https://arxiv.org/abs/2603.12696v2,https://arxiv.org/pdf/2603.12696v2,,,"""vision language navigation"""
d47666e5a49a,2603.13528v1,Learning Actionable Manipulation Recovery via Counterfactual Failure Synthesis,Dayou Li; Jiuzhou Lei; Hao Wang; Lulin Liu; Yunhao Yang; Zihan Wang; Bangya Liu; Minghui Zheng; Zhiwen Fan,2026-03-13,2026,arXiv,World Action Model; Multimodal Perception; Dataset / Simulator,Medium,https://arxiv.org/abs/2603.13528v1,https://arxiv.org/pdf/2603.13528v1,,,"""generative world model"""
daf424b36f42,2603.12553v1,Beyond Dense Futures: World Models as Structured Planners for Robotic Manipulation,Minghao Jin; Mozheng Liao; Mingfei Han; Zhihui Li; Xiaojun Chang,2026-03-13,2026,arXiv,Vision-Language-Action; World Action Model; Evaluation,Low,https://arxiv.org/abs/2603.12553v1,https://arxiv.org/pdf/2603.12553v1,,,"""generative world model"""
af5ff9fa96d6,2603.10682v1,OnFly: Onboard Zero-Shot Aerial Vision-Language Navigation toward Safety and Efficiency,Guiyong Zheng; Yueting Ban; Mingjie Zhang; Juepeng Zheng; Boyu Zhou,2026-03-11,2026,arXiv,UAV VLN; Navigation Foundation; Multimodal Perception,High,https://arxiv.org/abs/2603.10682v1,https://arxiv.org/pdf/2603.10682v1,,,"""aerial vision-language navigation"""
bea8ebedcd69,2603.10448v2,DiT4DiT: Jointly Modeling Video Dynamics and Actions for Generalizable Robot Control,Teli Ma; Jia Zheng; Zifan Wang; Chunli Jiang; Andy Cui; Junwei Liang; Shuo Yang,2026-03-11,2026,arXiv,Vision-Language-Action; World Action Model; Multimodal Perception; Evaluation,Low,https://arxiv.org/abs/2603.10448v2,https://arxiv.org/pdf/2603.10448v2,,,"""video prediction"""
4df09d6b5a49,2603.09194v1,WESPR: Wind-adaptive Energy-Efficient Safe Perception & Planning for Robust Flight with Quadrotors,Khuzema Habib; Pranav Deshakulkarni Manjunath; Kasra Torshizi; Troi Williams; Pratap Tokekar,2026-03-10,2026,arXiv,Traditional Navigation; Multimodal Perception,Medium,https://arxiv.org/abs/2603.09194v1,https://arxiv.org/pdf/2603.09194v1,,,"""drone navigation"""
783bc55c2743,2603.09740v1,Let's Reward Step-by-Step: Step-Aware Contrastive Alignment for Vision-Language Navigation in Continuous Environments,Haoyuan Li; Rui Liu; Hehe Fan; Yi Yang,2026-03-10,2026,arXiv,UAV VLN; Navigation Foundation; Evaluation,High,https://arxiv.org/abs/2603.09740v1,https://arxiv.org/pdf/2603.09740v1,,,"""vision language navigation"""
27a1c02f28fb,2603.09163v1,SPAN-Nav: Generalized Spatial Awareness for Versatile Vision-Language Navigation,Jiahang Liu; Tianyu Xu; Jiawei Chen; Lu Yue; Jiazhao Zhang; Zhiyong Wang; Minghan Li; Qisheng Zhao; Anqi Li; Qi Su; Zhizheng Zhang; He Wang,2026-03-10,2026,arXiv,UAV VLN; Navigation Foundation; Traditional Navigation; Embodied AI; Multimodal Perception; Evaluation,High,https://arxiv.org/abs/2603.09163v1,https://arxiv.org/pdf/2603.09163v1,,,"""embodied navigation"""
e68b7f03a15c,2603.09086v1,"Latent World Models for Automated Driving: A Unified Taxonomy, Evaluation Framework, and Open Challenges",Rongxiang Zeng; Yongqi Dong,2026-03-10,2026,arXiv,Vision-Language-Action; World Action Model; Multimodal Perception; Evaluation; Survey,Low,https://arxiv.org/abs/2603.09086v1,https://arxiv.org/pdf/2603.09086v1,,,"""generative world model"""
4b461f43580a,2603.09259v1,Implicit Geometry Representations for Vision-and-Language Navigation from Web Videos,Mingfei Han; Haihong Hao; Liang Ma; Kamila Zhumakhanova; Ekaterina Radionova; Jingyi Zhang; Xiaojun Chang; Xiaodan Liang; Ivan Laptev,2026-03-10,2026,CVPR,UAV VLN; Navigation Foundation; Embodied AI; Multimodal Perception; Evaluation,High,https://arxiv.org/abs/2603.09259v1,https://arxiv.org/pdf/2603.09259v1,,,"""embodied navigation"""
cc9055193e08,2603.09113v1,PM-Nav: Priori-Map Guided Embodied Navigation in Functional Buildings,Jiang Gao; Xiangyu Dong; Haozhou Li; Haoran Zhao; Yaoming Zhou; Xiaoguang Ma,2026-03-10,2026,arXiv,UAV VLN; Navigation Foundation; Traditional Navigation; Embodied AI; Multimodal Perception,High,https://arxiv.org/abs/2603.09113v1,https://arxiv.org/pdf/2603.09113v1,,,"""embodied navigation"""
bedee0d4dfd5,2603.08150v1,Edged USLAM: Edge-Aware Event-Based SLAM with Learning-Based Depth Priors,Şebnem Sarıözkan; Hürkan Şahin; Olaya Álvarez-Tuñón; Erdal Kayacan,2026-03-09,2026,ICRA,UAV VLN; Traditional Navigation; Multimodal Perception,High,https://arxiv.org/abs/2603.08150v1,https://arxiv.org/pdf/2603.08150v1,,,"""aerial navigation"""
70bce20c181a,2603.08007v1,ViSA-Enhanced Aerial VLN: A Visual-Spatial Reasoning Enhanced Framework for Aerial Vision-Language Navigation,Haoyu Tong; Xiangyu Dong; Xiaoguang Ma; Haoran Zhao; Yaoming Zhou; Chenghao Lin,2026-03-09,2026,arXiv,UAV VLN; Navigation Foundation; Evaluation,High,https://arxiv.org/abs/2603.08007v1,https://arxiv.org/pdf/2603.08007v1,,,"""aerial vision-language navigation"""
2a3b1bc5b3df,2603.08403v3,SPIRAL: Self-Evolving Action-Conditioned Video Generation via Reflective Planning Agents,Yu Yang; Yue Liao; Jianbiao Mei; Baisen Wang; Xuemeng Yang; Licheng Wen; Jiangning Zhang; Xiangtai Li; Liang Lv; Hanlin Chen; Botian Shi; Yong Liu; Shuicheng Yan; Gim Hee Lee,2026-03-09,2026,arXiv,World Action Model,Low,https://arxiv.org/abs/2603.08403v3,https://arxiv.org/pdf/2603.08403v3,,,"""action-conditioned video generation"""
bde51f892203,2603.08546v1,Interactive World Simulator for Robot Policy Training and Evaluation,Yixuan Wang; Rhythm Syed; Fangyu Wu; Mengchao Zhang; Aykut Onol; Jose Barreiros; Hooshang Nayyeri; Tony Dear; Huan Zhang; Yunzhu Li,2026-03-09,2026,arXiv,World Action Model; Multimodal Perception,Low,https://arxiv.org/abs/2603.08546v1,https://arxiv.org/pdf/2603.08546v1,,,"""video prediction"""
3d15d29cedaa,2603.08468v1,Integrating Lagrangian Neural Networks into the Dyna Framework for Reinforcement Learning,Shreya Das; Kundan Kumar; Muhammad Iqbal; Outi Savolainen; Dominik Baumann; Laura Ruotsalainen; Simo Särkkä,2026-03-09,2026,arXiv,World Action Model; Multimodal Perception,Low,https://arxiv.org/abs/2603.08468v1,https://arxiv.org/pdf/2603.08468v1,,,"""model-based reinforcement learning"""
e67155c2d607,2603.07799v1,MWM: Mobile World Models for Action-Conditioned Consistent Prediction,Han Yan; Zishang Xiang; Zeyu Zhang; Hao Tang,2026-03-08,2026,arXiv,UAV VLN; Navigation Foundation; Traditional Navigation; Embodied AI; Evaluation,High,https://arxiv.org/abs/2603.07799v1,https://arxiv.org/pdf/2603.07799v1,,,"""embodied navigation"""
13ebe42ac4fc,2603.07181v2,FreeFly-Thinking : Aligning Chain-of-Thought Reasoning with Continuous UAV Navigation,Jiaxu Zhou; Shaobo Wang; Zhiyuan Yang; Zhenjun Yu; Tao Li,2026-03-07,2026,ECCV,UAV VLN; Navigation Foundation; Instruction Following; Dataset / Simulator,High,https://arxiv.org/abs/2603.07181v2,https://arxiv.org/pdf/2603.07181v2,,,"""vision language navigation"""
8703a7b326df,2603.07264v1,Kinematics-Aware Latent World Models for Data-Efficient Autonomous Driving,Jiazhuo Li; Linjiang Cao; Qi Liu; Xi Xiong,2026-03-07,2026,arXiv,Vision-Language-Action; World Action Model; Multimodal Perception,Low,https://arxiv.org/abs/2603.07264v1,https://arxiv.org/pdf/2603.07264v1,,,"""model-based reinforcement learning"""
66b19c4d4870,2603.07083v2,Dreamer-CDP: Improving Reconstruction-free World Models Via Continuous Deterministic Representation Prediction,Michael Hauri; Friedemann Zenke,2026-03-07,2026,arXiv,Vision-Language-Action; World Action Model,Low,https://arxiv.org/abs/2603.07083v2,https://arxiv.org/pdf/2603.07083v2,,,"""model-based reinforcement learning"""
bb6cb1f805d5,2603.06480v1,History-Conditioned Spatio-Temporal Visual Token Pruning for Efficient Vision-Language Navigation,Qitong Wang; Yijun Liang; Ming Li; Tianyi Zhou; Christopher Rasmussen,2026-03-06,2026,arXiv,UAV VLN; Navigation Foundation; Vision-Language-Action,High,https://arxiv.org/abs/2603.06480v1,https://arxiv.org/pdf/2603.06480v1,,,"""instruction following navigation"""
5929e277c384,2603.06190v1,DreamToNav: Generalizable Navigation for Robots via Generative Video Planning,Valerii Serpiva; Jeffrin Sam; Chidera Simon; Hajira Amjad; Iana Zhura; Artem Lykov; Dzmitry Tsetserukou,2026-03-06,2026,arXiv,Traditional Navigation; World Action Model; Multimodal Perception; Evaluation,Medium,https://arxiv.org/abs/2603.06190v1,https://arxiv.org/pdf/2603.06190v1,,,"""video prediction"""
712aaef3f0d8,2603.06073v1,Lifelong Embodied Navigation Learning,Xudong Wang; Jiahua Dong; Baichen Liu; Qi Lyu; Lianqing Liu; Zhi Han,2026-03-06,2026,arXiv,UAV VLN; Navigation Foundation; Embodied AI; Multimodal Perception,High,https://arxiv.org/abs/2603.06073v1,https://arxiv.org/pdf/2603.06073v1,,,"""embodied navigation"""
685dfbbe03d5,2603.05377v2,OpenFrontier: General Navigation with Visual-Language Grounded Frontiers,Esteban Padilla-Cerdio; Boyang Sun; Marc Pollefeys; Hermann Blum,2026-03-05,2026,arXiv,UAV VLN; Navigation Foundation; Vision-Language-Action; Multimodal Perception; Evaluation,High,https://arxiv.org/abs/2603.05377v2,https://arxiv.org/pdf/2603.05377v2,,,"""vision language navigation"""
fdc00b39a349,2603.05438v1,Planning in 8 Tokens: A Compact Discrete Tokenizer for Latent World Model,Dongwon Kim; Gawon Seo; Jinsung Lee; Minsu Cho; Suha Kwak,2026-03-05,2026,CVPR,Vision-Language-Action; World Action Model; Multimodal Perception,Low,https://arxiv.org/abs/2603.05438v1,https://arxiv.org/pdf/2603.05438v1,,,"""action-conditioned world model"""
7f38b21c1973,2603.05449v1,RealWonder: Real-Time Physical Action-Conditioned Video Generation,Wei Liu; Ziyu Chen; Zizhang Li; Yue Wang; Hong-Xing Yu; Jiajun Wu,2026-03-05,2026,arXiv,Traditional Navigation; World Action Model; Multimodal Perception,Medium,https://arxiv.org/abs/2603.05449v1,https://arxiv.org/pdf/2603.05449v1,,,"""action-conditioned video generation"""
733856345167,2603.03745v1,RAGNav: A Retrieval-Augmented Topological Reasoning Framework for Multi-Goal Visual-Language Navigation,Ling Luo; Qiangian Bai,2026-03-04,2026,arXiv,UAV VLN; Navigation Foundation; Traditional Navigation; Multimodal Perception,High,https://arxiv.org/abs/2603.03745v1,https://arxiv.org/pdf/2603.03745v1,,,"""vision language navigation"""
7a659c52aa50,2603.03739v1,PROSPECT: Unified Streaming Vision-Language Navigation via Semantic--Spatial Fusion and Latent Predictive Representation,Zehua Fan; Wenqi Lyu; Wenxuan Song; Linge Zhao; Yifei Yang; Xi Wang; Junjie He; Lida Huang; Haiyan Liu; Bingchuan Sun; Guangjun Bao; Xuanyao Mao; Liang Xu; Yan Wang; Feng Gao,2026-03-04,2026,arXiv,UAV VLN; Navigation Foundation; Vision-Language-Action; Dataset / Simulator,High,https://arxiv.org/abs/2603.03739v1,https://arxiv.org/pdf/2603.03739v1,,,"""vision language navigation"""
1d076252ecc4,2603.04029v1,Self-adapting Robotic Agents through Online Continual Reinforcement Learning with World Model Feedback,Fabian Domberg; Georg Schildbach,2026-03-04,2026,IROS,World Action Model; Embodied AI; Multimodal Perception,Medium,https://arxiv.org/abs/2603.04029v1,https://arxiv.org/pdf/2603.04029v1,,,"""model-based reinforcement learning"""
9312ae952647,2603.06687v2,TimeSpot: Benchmarking Geo-Temporal Understanding in Vision-Language Models in Real-World Settings,Azmine Toushik Wasi; Shahriyar Zaman Ridoy; Koushik Ahamed Tonmoy; Kinga Tshering; S. M. Muhtasimul Hasan; Wahid Faisal; Tasnim Mohiuddin; Md Rizwan Parvez,2026-03-04,2026,ICML,UAV VLN; Navigation Foundation; Embodied AI,High,https://arxiv.org/abs/2603.06687v2,https://arxiv.org/pdf/2603.06687v2,,,"""embodied navigation"""
6e20e60ea751,2603.04470v1,Efficient Autonomous Navigation of a Quadruped Robot in Underground Mines on Edge Hardware,Yixiang Gao; Kwame Awuah-Offei,2026-03-04,2026,arXiv,UAV VLN; Navigation Foundation; Traditional Navigation; Embodied AI; Multimodal Perception; Evaluation,High,https://arxiv.org/abs/2603.04470v1,https://arxiv.org/pdf/2603.04470v1,,,"""embodied navigation"""
3254d6df7269,2603.03024v1,MA-CoNav: A Master-Slave Multi-Agent Framework with Hierarchical Collaboration and Dual-Level Reflection for Long-Horizon Embodied VLN,Ling Luo; Qianqian Bai,2026-03-03,2026,arXiv,UAV VLN; Navigation Foundation; Multimodal Perception,High,https://arxiv.org/abs/2603.03024v1,https://arxiv.org/pdf/2603.03024v1,,,"""vision language navigation"""
ec140638b717,2603.02972v2,TagaVLM: Topology-Aware Global Action Reasoning for Vision-Language Navigation,Jiaxing Liu; Zexi Zhang; Xiaoyan Li; Boyue Wang; Yongli Hu; Baocai Yin,2026-03-03,2026,arXiv,UAV VLN; Navigation Foundation; Evaluation,High,https://arxiv.org/abs/2603.02972v2,https://arxiv.org/pdf/2603.02972v2,,,"""vision language navigation"""
179187aa914f,2603.03485v2,Phys4D: Fine-Grained Physics-Consistent 4D Modeling from Video Diffusion,Haoran Lu; Shang Wu; Jianshu Zhang; Maojiang Su; Guo Ye; Chenwei Xu; Lie Lu; Pranav Maneriker; Fan Du; Manling Li; Zhaoran Wang; Han Liu,2026-03-03,2026,arXiv,World Action Model; Multimodal Perception,Low,https://arxiv.org/abs/2603.03485v2,https://arxiv.org/pdf/2603.03485v2,,,"""generative world model"""
9a9fb5066519,2603.02765v1,Next Embedding Prediction Makes World Models Stronger,George Bredis; Nikita Balagansky; Daniil Gavrilov; Ruslan Rakhimov,2026-03-03,2026,arXiv,Navigation Foundation; World Action Model,Medium,https://arxiv.org/abs/2603.02765v1,https://arxiv.org/pdf/2603.02765v1,,,"""model-based reinforcement learning"""
4ec403cef4fb,2603.02772v1,Agentic Self-Evolutionary Replanning for Embodied Navigation,Guoliang Li; Ruihua Han; Chengyang Li; He Li; Shuai Wang; Wenchao Ding; Hong Zhang; Chengzhong Xu,2026-03-03,2026,arXiv,UAV VLN; Navigation Foundation; Embodied AI; Multimodal Perception; Evaluation,High,https://arxiv.org/abs/2603.02772v1,https://arxiv.org/pdf/2603.02772v1,,,"""embodied navigation"""
ee27b685c255,2603.02291v1,Goal-Oriented Semantic Communication for ISAC-Enabled Robotic Obstacle Avoidance,Wenjie Liu; Yansha Deng; Henk Wymeersch,2026-03-02,2026,arXiv,UAV VLN; Traditional Navigation; Multimodal Perception; Evaluation,High,https://arxiv.org/abs/2603.02291v1,https://arxiv.org/pdf/2603.02291v1,,,"""uav navigation"""
215d2bb517bb,2603.01452v1,"Scaling Tasks, Not Samples: Mastering Humanoid Control through Multi-Task Model-Based Reinforcement Learning",Shaohuai Liu; Weirui Ye; Yilun Du; Le Xie,2026-03-02,2026,arXiv,World Action Model; Embodied AI,Medium,https://arxiv.org/abs/2603.01452v1,https://arxiv.org/pdf/2603.01452v1,,,"""model-based reinforcement learning"""
19108ad16a99,2603.02004v1,CHOP: Counterfactual Human Preference Labels Improve Obstacle Avoidance in Visuomotor Navigation Policies,Gershom Seneviratne; Jianyu An; Vaibhav Shende; Sahire Ellahy; Yaxita Amin; Kondapi Manasanjani; Samarth Chopra; Jonathan Deepak Kannan; Dinesh Manocha,2026-03-02,2026,arXiv,UAV VLN; Navigation Foundation; Traditional Navigation; Embodied AI; Multimodal Perception; Evaluation,High,https://arxiv.org/abs/2603.02004v1,https://arxiv.org/pdf/2603.02004v1,,,"""embodied navigation"""
a8a41bc0118b,2602.23937v1,Enhancing Vision-Language Navigation with Multimodal Event Knowledge from Real-World Indoor Tour Videos,Haoxuan Xu; Tianfu Li; Wenbo Chen; Yi Liu; Xingxing Zuo; Yaoxian Song; Haoang Li,2026-02-27,2026,arXiv,UAV VLN; Navigation Foundation,High,https://arxiv.org/abs/2602.23937v1,https://arxiv.org/pdf/2602.23937v1,,,"""vision language navigation"""
ae0f0065ac59,2602.23152v1,The Trinity of Consistency as a Defining Principle for General World Models,Jingxuan Wei; Siyuan Li; Yuhang Xu; Zheng Sun; Junjie Jiang; Hexuan Jin; Caijun Jia; Honghao He; Xinglong Xu; Xi bai; Chang Yu; Yumou Liu; Junnan Zhu; Xuanhe Zhou; Jintao Chen; Xiaobin Hu; Shancheng Pang; Bihui Yu; Ran He; Zhen Lei; Stan Z. Li; Conghui He; Shuicheng Yan; Cheng Tan,2026-02-26,2026,arXiv,World Action Model; Multimodal Perception; Survey,Low,https://arxiv.org/abs/2602.23152v1,https://arxiv.org/pdf/2602.23152v1,,,"""generative world model"""
bbf0947db7e2,2602.21633v1,Self-Correcting VLA: Online Action Refinement via Sparse World Imagination,Chenyv Liu; Wentao Tan; Lei Zhu; Fengling Li; Jingjing Li; Guoli Yang; Heng Tao Shen,2026-02-25,2026,arXiv,Traditional Navigation; Vision-Language-Action; World Action Model; Multimodal Perception; Evaluation,Medium,https://arxiv.org/abs/2602.21633v1,https://arxiv.org/pdf/2602.21633v1,,,"""world action model"""
cd28d7381ffd,2602.22208v2,Solaris: Building a Multiplayer Video World Model in Minecraft,Georgy Savva; Oscar Michel; Daohan Lu; Suppakit Waiwitlikhit; Timothy Meehan; Dhairya Mishra; Srivats Poddar; Jack Lu; Saining Xie,2026-02-25,2026,arXiv,World Action Model; Multimodal Perception,Low,https://arxiv.org/abs/2602.22208v2,https://arxiv.org/pdf/2602.22208v2,,,"""action-conditioned video generation"""
316489e9e45f,2602.21816v1,Self-Curriculum Model-based Reinforcement Learning for Shape Control of Deformable Linear Objects,Zhaowei Liang; Song Wang; Zhao Jin; Shirui Wu; Dan Wu,2026-02-25,2026,arXiv,Vision-Language-Action; World Action Model; Multimodal Perception; Evaluation,Low,https://arxiv.org/abs/2602.21816v1,https://arxiv.org/pdf/2602.21816v1,,,"""model-based reinforcement learning"""
e62270086e86,2602.18739v1,When World Models Dream Wrong: Physical-Conditioned Adversarial Attacks against World Models,Zhixiang Guo; Siyuan Liang; Andras Balogh; Noah Lunberry; Rong-Cheng Tu; Mark Jelasity; Dacheng Tao,2026-02-21,2026,arXiv,World Action Model; Evaluation,Low,https://arxiv.org/abs/2602.18739v1,https://arxiv.org/pdf/2602.18739v1,,,"""generative world model"""
5f4437d903b9,2602.18424v1,CapNav: Benchmarking Vision Language Models on Capability-conditioned Indoor Navigation,Xia Su; Ruiqi Chen; Benlin Liu; Jingwei Ma; Zonglin Di; Ranjay Krishna; Jon Froehlich,2026-02-20,2026,arXiv,UAV VLN; Navigation Foundation,High,https://arxiv.org/abs/2602.18424v1,https://arxiv.org/pdf/2602.18424v1,,,"""vision language navigation"""
387dae8f6c1a,2602.15922v1,World Action Models are Zero-shot Policies,"Seonghyeon Ye; Yunhao Ge; Kaiyuan Zheng; Shenyuan Gao; Sihyun Yu; George Kurian; Suneel Indupuru; You Liang Tan; Chuning Zhu; Jiannan Xiang; Ayaan Malik; Kyungmin Lee; William Liang; Nadun Ranawaka; Jiasheng Gu; Yinzhen Xu; Guanzhi Wang; Fengyuan Hu; Avnish Narayan; Johan Bjorck; Jing Wang; Gwanghyun Kim; Dantong Niu; Ruijie Zheng; Yuqi Xie; Jimmy Wu; Qi Wang; Ryan Julian; Danfei Xu; Yilun Du; Yevgen Chebotar; Scott Reed; Jan Kautz; Yuke Zhu; Linxi ""Jim"" Fan; Joel Jang",2026-02-17,2026,arXiv,Vision-Language-Action; World Action Model; Evaluation,Low,https://arxiv.org/abs/2602.15922v1,https://arxiv.org/pdf/2602.15922v1,,,"""world action model"""
0a17be9a077f,2602.14401v1,pFedNavi: Structure-Aware Personalized Federated Vision-Language Navigation for Embodied AI,Qingqian Yang; Hao Wang; Sai Qian Zhang; Jian Li; Yang Hua; Miao Pan; Tao Song; Zhengwei Qi; Haibing Guan,2026-02-16,2026,arXiv,UAV VLN; Navigation Foundation; Embodied AI; Evaluation,High,https://arxiv.org/abs/2602.14401v1,https://arxiv.org/pdf/2602.14401v1,,,"""vision language navigation"""
c43f05e7a058,2602.14351v2,WIMLE: Uncertainty-Aware World Models with IMLE for Sample-Efficient Continuous Control,Mehran Aghabozorgi; Alireza Moazeni; Yanshu Zhang; Ke Li,2026-02-15,2026,ICLR,World Action Model; Multimodal Perception,Low,https://arxiv.org/abs/2602.14351v2,https://arxiv.org/pdf/2602.14351v2,,,"""model-based reinforcement learning"""
993dcf605f81,2602.13977v1,WoVR: World Models as Reliable Simulators for Post-Training VLA Policies with RL,Zhennan Jiang; Shangqing Zhou; Yutong Jiang; Zefang Huang; Mingjie Wei; Yuhui Chen; Tianxing Zhou; Zhen Guo; Hao Lin; Quanlu Zhang; Yu Wang; Haoran Li; Chao Yu; Dongbin Zhao,2026-02-15,2026,arXiv,Vision-Language-Action; World Action Model; Multimodal Perception,Low,https://arxiv.org/abs/2602.13977v1,https://arxiv.org/pdf/2602.13977v1,,,"""model-based reinforcement learning"""
75103b826d2a,2602.12520v1,Multi-Agent Model-Based Reinforcement Learning with Joint State-Action Learned Embeddings,Zhizun Wang; David Meger,2026-02-13,2026,arXiv,World Action Model,Low,https://arxiv.org/abs/2602.12520v1,https://arxiv.org/pdf/2602.12520v1,,,"""model-based reinforcement learning"""
1c7904eeab86,2602.11499v2,What if Agents Could Imagine? Reinforcing Open-Vocabulary HOI Comprehension through Generation,Zhenlong Yuan; Yue Wang; Dapeng Zhang; Kejin Cui; Rui Chen; Jing Tang; Lei Sun; Hongwei Yu; Chengxuan Qian; Xiangxiang Chu; Shuo Li; Yuyin Zhou,2026-02-12,2026,arXiv,World Action Model,Low,https://arxiv.org/abs/2602.11499v2,https://arxiv.org/pdf/2602.11499v2,,,"""generative world model"""
62fbe6147269,2602.12063v2,VLAW: Iterative Co-Improvement of Vision-Language-Action Policy and World Model,Yanjiang Guo; Tony Lee; Lucy Xiaoyang Shi; Jianyu Chen; Percy Liang; Chelsea Finn,2026-02-12,2026,arXiv,Vision-Language-Action; World Action Model; Multimodal Perception; Dataset / Simulator; Evaluation,Medium,https://arxiv.org/abs/2602.12063v2,https://arxiv.org/pdf/2602.12063v2,,,"""action-conditioned video generation"""
cd38740b9737,2602.11832v1,JEPA-VLA: Video Predictive Embedding is Needed for VLA Models,Shangchen Miao; Ningya Feng; Jialong Wu; Ye Lin; Xu He; Dong Li; Mingsheng Long,2026-02-12,2026,arXiv,Vision-Language-Action; Evaluation,Low,https://arxiv.org/abs/2602.11832v1,https://arxiv.org/pdf/2602.11832v1,,,"""video prediction"""
3da5169b9261,2602.12099v2,GigaBrain-0.5M*: a VLA That Learns From World Model-Based Reinforcement Learning,GigaBrain Team; Boyuan Wang; Bohan Li; Chaojun Ni; Guan Huang; Guosheng Zhao; Hao Li; Jie Li; Jindi Lv; Jingyu Liu; Lv Feng; Mingming Yu; Peng Li; Qiuping Deng; Tianze Liu; Xinyu Zhou; Xinze Chen; Xiaofeng Wang; Yang Wang; Yifan Li; Yifei Nie; Yilong Li; Yukun Zhou; Yun Ye; Zhichao Liu; Zheng Zhu,2026-02-12,2026,arXiv,Vision-Language-Action; World Action Model; Multimodal Perception,Low,https://arxiv.org/abs/2602.12099v2,https://arxiv.org/pdf/2602.12099v2,,,"""model-based reinforcement learning"""
e20ec084147a,2602.11598v1,ABot-N0: Technical Report on the VLA Foundation Model for Versatile Embodied Navigation,Zedong Chu; Shichao Xie; Xiaolong Wu; Yanfen Shen; Minghua Luo; Zhengbo Wang; Fei Liu; Xiaoxu Leng; Junjun Hu; Mingyang Yin; Jia Lu; Yingnan Guo; Kai Yang; Jiawei Han; Xu Chen; Yanqing Zhu; Yuxiang Zhao; Xin Liu; Yirong Yang; Ye He; Jiahang Wang; Yang Cai; Tianlin Zhang; Li Gao; Liu Liu; Mingchao Sun; Fan Jiang; Chiyu Wang; Zhicheng Liu; Hongyu Pan; Honglin Han; Zhining Gu; Kuan Yang; Jianfang Zhang; Di Jing; Zihao Guan; Wei Guo; Guoqing Liu; Di Yang; Xiangpo Yang; Menglin Yang; Hongguang Xing; Weiguo Li; Mu Xu,2026-02-12,2026,arXiv,UAV VLN; Navigation Foundation; Vision-Language-Action; Embodied AI,High,https://arxiv.org/abs/2602.11598v1,https://arxiv.org/pdf/2602.11598v1,,,"""embodied navigation"""
c56d6813f3fd,2602.10704v2,(MGS)$^2$-Net: Unifying Micro-Geometric Scale and Macro-Geometric Structure for Cross-View Geo-Localization,Minglei Li; Mengfan He; Chunyu Li; Chao Chen; Xingyu Shao; Ziyang Meng,2026-02-11,2026,arXiv,UAV VLN; Evaluation,High,https://arxiv.org/abs/2602.10704v2,https://arxiv.org/pdf/2602.10704v2,,,"""uav navigation"""
e06d0d2d78ac,2602.11291v2,H-WM: Robotic Task and Motion Planning Guided by Hierarchical World Model,Jinbang Huang; Wenyuan Chen; Zhiyuan Li; Oscar Pang; Xiao Hu; Lingfeng Zhang; Yuanzhao Hu; Zhanguang Zhang; Mark Coates; Tongtong Cao; Xingyue Quan; Yingxue Zhang,2026-02-11,2026,arXiv,Traditional Navigation; Vision-Language-Action; World Action Model; Multimodal Perception,Medium,https://arxiv.org/abs/2602.11291v2,https://arxiv.org/pdf/2602.11291v2,,,"""visual world model"""
